Label,Brand,Name,Price,Rank,Ingredients,Combination,Dry,Normal,Oily,Sensitive
Moisturizer,CLINIQUE,Even Better Skin Tone Correcting Moisturizer Broad Spectrum SPF 20,50,4.1,"Octisalate 5.00% , Avobenzone 3.00% , Octocrylene 2.70%Water , Butyloctyl Salicylate , Nylon-12 , Octyldodecyl Neopentanoate , Behenyl Alcohol , Myristyl Myristate , Saccharomyces Cerevisiae Extract , Ascorbyl Glucoside , Cetyl Esters , Butylene Glycol , Polyethylene , Ammonium Acryloyldimethyltaurate/Vp Copolymer , Yeast Extract/Faex/Extrait De Levure , Betula Alba (Birch) Bark Extract , Cucumis Sativus (Cucumber) Fruit Extract , Scutellaria Baicalensis Root Extract , Pyrus Malus (Apple) Fruit Extract , Trametes Versicolor Extract , Triticum Vulgare (Wheat Bran) Extract , Saccharomyces Lysate Extract , Punica Granatum (Pomegranate) Juice Extract , Olea Europaea (Olive) Fruit Extract , Curcuma Longa (Turmeric) Root Extract , Oryza Sativa (Rice) Bran Extract , Citrus Grandis (Grapefruit) Peel Extract , Peg-6 , Cholesterol , Dimethicone , Glyceryl Stearate , Peg-100 Stearate , Glycerin , Di-Ppg-2 Myreth-10 Adipate , Steareth-21 , Caffeine , Sodium Rna , Cellulose , Acetyl Glucosamine , Simethicone , Tromethamine , Sucrose , Di-C12-18 Alkyl Dimonium Chloride , Salicylic Acid , Sodium Hyaluronate , Tocopheryl Acetate , Trisiloxane , Linoleic Acid , Caprylyl Glycol , Sodium Sulfite , Sodium Metabisulfite , Magnesium Ascorbyl Phosphate , Betaine , Trehalose , Hexylene Glycol , Dipotassium Glycyrrhizate , Lauryl Peg-9 Polydimethylsiloxyethyl Dimethicone , Disodium Edta , Phenoxyethanol , Polyaminopropyl Biguanide",0,0,0,0,0
Treatment,DR. DENNIS GROSS SKINCARE,Doctor's Kit Gold Standard Anti-Aging Solution,59,5.0,Visit the Dr. Dennis Gross Skincare boutique,1,1,1,1,1
Eye cream,DR. JART+,Water Fuse Hydro Soothe Eye Gel,42,3.7,"Water, Propanediol, PEG-8, Dipropylene Glycol, Niacinamide, Glycereth-26, 1,2-Hexanediol, Alcohol Denat., Glycerin, Trehalose, Ammonium Acryloyldimethyltaurate/VP Copolymer, Sodium Acrylates Crosspolymer-2, Sodium Carbomer, Sodium Polyacrylate Starch, PEG-60 Hydrogenated Castor Oil, Hydroxyacetophenone, Dimethicone, PEG-2M, Hydrogenated Lecithin, Menthoxypropanediol, Sucrose Distearate, Adenosine, Alcohol, Butylene Glycol, Disodium EDTA, Malachite Extract, Phenoxyethanol, Melia Azadirachta Leaf Extract, Melia Azadirachta Flower Extract, Silica, Magnesium aspartate, Zinc Gluconate, Coptis Japonica Root Extract, Citrus Grandis (Grapefruit) Peel Oil, Amino Esters-1, Sodium Hyaluronate, Heptane, Coccinia Indica Fruit Extract, Solanum Melongena (Eggplant) Fruit Extract, Aloe Barbadensis Flower Extract, Copper gluconate, Citrus Aurantium Dulcis (Orange) Peel Oil, Onsen-Sui, Simmondsia Chinensis (Jojoba) Seed Oil, Lawsonia Inermis (Henna) Extract, Ethylhexylglycerin, Corallina Officinalis Extract, Curcuma Longa (Turmeric) Root Extract, Ocimum Sanctum Leaf Extract, Pelargonium Graveolens Flower Oil, Boswellia Carterii Oil, Citrus Paradisi (Grapefruit) Peel Oil, Amyris Balsamifera Bark Oil, Maltodextrin, Hydrolyzed Vegetable Protein, Sodium Glycerophosphate, Carbomer, Sodium Lactate, Potassium Magnesium Aspartate, Polysorbate 20, Calcium Gluconate, Magnesium Gluconate, Caprylyl Glycol, Aloe Barbadensis Leaf Extract, Cinchona Succirubra Bark Extract, Psidium Guajava Leaf Extract, Abronia Villosa Leaf Extract, Rhodiola Rosea Root Extract, Palmitoyl Oligopeptide, Palmitoyl Tetrapeptide-7, Hydrolyzed Hyaluronic Acid.",1,1,1,1,1
Eye cream,BIOSSANCE,Squalane + Peptide Eye Gel,54,3.8,"Water, Aloe Barbadensis Leaf Juice*, Squalane (Material), Niacinamide, Glycerin, Panthenol, Algae Extract, Malus Domestica Fruit Cell Culture Extract, Acetyl Tetrapeptide-5, Acetyl Hexapeptide-8, Tocopherol, Pentylene Glycol, Cucumis Sativus (Cucumber) Fruit Extract, Tetrahexyldecyl Ascorbate, Camellia Sinensis Leaf Extract, Lycium Barbarum (Go Ji) Fruit Extract, Lycopene, Vitis Vinifera (Grape) Skin Extract, Sodium Hyaluronate, Caffeine, Acacia Senegal Gum, Dimethicone CrossPolymer, Carbomer, Lauric Arginate, Ammonium Acryloyldimethyltaurate/VP Copolymer, Silica, Potassium Sorbate, Caprylyl Glycol.",1,1,1,1,1
Treatment,DR. DENNIS GROSS SKINCARE,Hyaluronic Marine Hydration Booster,68,4.4,"Oenothera Biennis (Evening Primrose) Flower/Leaf/Stem Extract, Glycerin, Saccharide Isomerate, Yucca Aloifolia Leaf/Root Extract, Sodium Hyaluronate, Linoleic Acid, Centella Asiatica Extract, Cucumis Sativus (Cucumber) Fruit Extract, Ceramide AP, Ceramide EOP, Ceramide NP, Citrullus Lanatus (Watermelon) Fruit Extract, Hydrolyzed Collagen, Camellia Sinensis Leaf Extract, Quercetin Caprylate, Glycolic Acid, Lactic Acid, Chamomilla Recutita (Matricaria) Flower Extract, Glycine Soja (Soybean) Extract, Retinol, Tocopheryl Acetate, Symphytum Officinale Extract, Cocos Nucifera (Coconut) Fruit Juice, Tetrapeptide-21, Copper PCA, Sodium PCA, Urea, Bisabolol, Acrylates/Carbamate Copolymer, C13-14 Isoparaffin, Phytosphingosine, Zinc PCA, Laureth-7, Sodium Lauroyl Lactylate, Isosteareth-200 Linoleate, Polysorbate 20, Carbomer, Cholesterol, Polyacrylamide, Xanthan Gum, Disodium EDTA, Phenoxyethanol, Sodium Benzoate, Fragrance.",0,0,0,0,0
Eye cream,OMOROVICZA,Reviving Eye Cream,145,3.8,"Hungarian Thermal Water, Glycerin, Simmondsia Chinensis (Jojoba) Oil, Squalane, Cetearyl Ethylhexanoate, Stearyl Heptanoate, Cetearyl Olivate, Helianthus Annuus (Sunflower) Seed Oil, Sorbitan Oilivate, Butyrospermum Parkii (Shea) Butter, Caprylic/Capric Triglyceride, Cetearyl Alcohol, Phenoxyethanol, Mannitol, Ascorbyl Tetraisopalmitate, Benzyl Alcohol, Calendula Officinalis Flower Extract, Laminaria Digitata Extract, Prunus Armeniaca (Apricot) Kernel Oil, Prunus Domestica Seed Extract, Pyrus Malus (Apple) Fruit Extract, Ethylhexylglycerin, Disodium EDTA, Tocopherol, Xanthan Gum, Yeast Extract, Chlorella Vulgaris/Lupinus Albus Proteine Ferment, Pectin, Lactic Acid, Potassium Sorbate.",0,0,0,0,0
Cleanser,ESTÉE LAUDER,Nutritious Radiant Vitality Energy Lotion,58,0.0,"Nutritious Vitality8 Egy Lot Int M Division: El (Estee Lauder)Ingredients: Water , Alcohol Denat. , Glycerin , Dipropylene Glycol , Propanediol , Trehalose , Citrullus Vulgaris (Watermelon) Fruit Extract , Lens Esculenta (Lentil) Fruit Extract , Pyrus Malus (Apple) Fruit Extract , Cucumis Sativus (Cucumber) Fruit Extract , Panax Ginseng (Ginseng) Root Extract , Vaccinium Macrocarpon (Cranberry) Fruit Extract , Vaccinium Angustifolium (Blueberry) Fruit Extract , Lycium Chinense (Wolfberry) Fruit Extract , Punica Granatum (Pomegranate) Extract , Acetyl Glucosamine , Sodium Pca , Sapindus Mukurossi Fruit Extract , Algae Extract , Garcinia Mangostana Peel Extract , Caesalpinia Spinosa Gum , Ergothioneine , Caffeine , Yeast Extract/Faex/Extrait De Levure , Sodium Lactate , Sodium Hyaluronate , Peg-8 , Ppg-6-Decyltetradeceth-30 , Butylene Glycol , Tromethamine , Tocopheryl Acetate , Tetrahexyldecyl Ascorbate , Carbomer , Citric Acid , Fragrance , Trisodium Hedta , Phenoxyethanol , Yellow 6 (Ci 15985) , Red 4 (Ci 14700)",0,0,0,0,0
Sun protect,LAURA MERCIER,Foundation Primer Protect Broad Spectrum SPF 30 Sunscreen PA+++,38,4.1,Visit the Laura Mercier boutique,0,0,0,0,0
Moisturizer,AMOREPACIFIC,FUTURE RESPONSE Age Defense Creme,195,4.4,"Camellia Sinensis Leaf Water, Butylene Glycol, Dicaprylyl Carbonate, Caprylic/Capric Triglyceride, Glycerin, Water, Butyrospermum Parkii (Shea) Butter, Alcohol, Behenyl Alcohol, Hydrogenated Poly(C6-14 Olefin), Arachidyl Alcohol, Pentaerythrityl Tetraisostearate, Pentaerythrityl Tetraethylhexanoate, Dimethicone, Mangifera Indica (Mango) Seed Butter, Hydrogenated Polydecene, Tricholoma Matsutake Extract, Camellia Sinensis Leaf Extract, Sodium Hyaluronate, Punica Granatum Extract, Opuntia Coccinellifera Fruit Extract, Iris Florentina Root Extract, Lagerstroemia Indica Flower Extract, Gossypium Herbaceum (Cotton) Extract, Centella Asiatica Extract, Oryza Sativa (Rice) Germ Extract, Zingiber Officinale (Ginger) Root Extract, Glycine Soja (Soybean) Seed Extract, Magnolia Obovata Bark Extract, Nelumbo Nucifera Flower Extract, Camellia Sinensis Leaf Powder, Theanine, Epigallocatechin Gallate, Sorbitol, Beta-Glucan, Trisiloxane, Arachidyl Glucoside, Polyacrylate-13, Propanediol, Cyclopentasiloxane, Dimethiconol, Polyisobutene, Carbomer, Glyceryl Stearate, Peg-100 Stearate, Polysorbate 20, 1,2-Hexanediol, Caprylyl Glycol, Polyglutamic Acid, Kaolin, Ethylhexylglycerin, Triethanolamine, Disodium Edta, Phenoxyethanol, Fragrance.",1,1,1,1,1
Moisturizer,LANEIGE,Water Bank Dual Layer Face Oil,38,5.0,"Water, Caprylic/Capric Triglyceride, Squalane, Vitis Vinifera (Grape) Seed Oil, Decyl Cocoate, Dicaprylyl Carbonate, Triethylhexanoin, Glycerin, Passiflora Incarnata Seed Oil, Macadamia Ternifolia Seed Oil, Chenopodium Quinoa Seed Extract, Magnesium Sulfate, Zinc Sulfate, Manganese Sulfate, Tocopherol, Calcium Chloride, Sodium Chloride, Alcohol, Xanthan Gum, Ascorbyl Glucoside, Disodium Edta, Phenoxyethanol, Ethylhexylglycerin, Fragrance.",1,1,1,0,0
Eye cream,CLARINS,Extra-Firming Eye Wrinkle Smoothing Cream,64,4.0,"Water, Glycerin, Caprylic/Capric Triglyceride, Silica, Cetearyl Alcohol, Betaine, Hydrogenated Coco-Glycerides, Pentylene Glycol, Butyrospermum Parkii (Shea) Butter, Glyceryl Stearate, Peg- 100 Stearate, Cetearyl Glucoside, Steareth-21, Dimethicone, Phenoxyethanol, Carbomer, Rosa Centifolia Flower Wax, Rosa Damascena Flower Wax, Ethylhexylglycerin, Tocopheryl Acetate, Alcohol, Disodium Edta, Escin, Fragrance, Sodium Dextran Sulfate, Dimethiconol, Sodium Hydroxide, Dehydroacetic Acid, Tocopherol, Musa Sapientum (Banana) Fruit Extract, Ribes Nigrum (Black Currant) Bud Extract, Thymus Citriodorus Flower/Leaf Extract, Helianthus Annuus (Sunflower) Seed Oil, Potassium Sorbate.",0,0,0,0,0
Eye cream,TARTE,Maracuja C-Brighter™ Eye Treatment,38,4.0,"Water, Glycerin, Butylene Glycol, Mangifera Indica (Mango) Seed Butter, Dimethicone, Hydrogenated Castor Oil Isostearate, Polyglyceryl-10 Pentastearate, Behenyl Alcohol, Cocos Nucifera (Coconut) Oil, Pentaerythrityl Tetraethylhexanoate, Tetrahexyldecyl Ascorbate, Caprylyl Methicone, Cetearyl Alcohol, Glyceryl Stearate, Sodium Stearoyl Lactylate, Panthenol, Caprylyl Glycol, Alcohol, Squalane, Polysorbate 80, Sodium Polyacrylate, Hydroxyethyl Acrylate/Sodium Acryloyldimethyl Taurate Copolymer, Cyclopentasiloxane, Mica, Dipropylene Glycol, Sodium Acrylate/Sodium Acryloyldimethyl Taurate Copolymer, Glycosphingolipids, Hordeum Vulgare Extract, Tocotrienols, Isohexadecane, Elaeis Guineensis (Palm) Oil, Tocopheryl Acetate, Dimethiconol, Dipotassium Glycyrrhizate, Chlorella Vulgaris Extract, Phospholipids, Adenosine, Tocopherol, Polysorbate 60, Sodium Hyaluronate, Sorbitan Isostearate, Disodium EDTA, 1,2-Hexanediol, Beta-Glucan, Passiflora Edulis Seed Oil, Ascorbyl Palmitate, Retinyl Palmitate, Phenoxyethanol, Sodium Benzoate, Titanium Dioxide (CI 77891).",1,1,1,1,1
Treatment,PEACE OUT,Pore Treatment Strips,19,4.2,"-Hydrocolloid Bandage: Absorbs sebum, oil, and dead skin trapped deep within pores. -DMAE: Helps visibly shrink enlarged pores. -Vitamin A: Refines skin texture and prevents blackheads from forming.",1,1,1,1,1
Treatment,FRESH,Crème Ancienne Face Oil Elixir,265,3.6,"Limnanthes Alba (Meadowfoam) Seed Oil, Simmondsia Chinensis (Jojoba) Seed Oil, Triticum Vulgare (Wheat) Germ Oil, Ribes Nigrum (Black Currant) Seed Oil, Hippophae Rhamnoides Oil, Commiphora Mukul Resin Extract, Helianthus Annuus (Sunflower) Seed Oil, Rosmarinus Officinalis (Rosemary) Leaf Extract, Ascorbyl Palmitate, Caprylic/Capric Triglyceride, Dipalmitoyl Hydroxyproline, Palmitic Acid.",1,1,1,1,1
Cleanser,CLINIQUE,Pep-Start 2-in-1 Exfoliating Cleanser,19,4.5,"Water , Glycerin , Sodium Laureth Sulfate , Silica , Acrylates Copolymer , Lauramidopropyl Betaine , Butylene Glycol , Sucrose , Cocamidopropyl Hydroxysultaine , Carica Papaya (Papaya) Fruit Extract , Bambusa Arundinacea (Bamboo) Stem Extract , Laminaria Saccharina Extract , Salicylic Acid , Palmitoyl Tetrapeptide-7 , Palmitoyl Tripeptide-1 , Caffeine , Sodium Hyaluronate , Acetyl Glucosamine , Sodium Coco Pg-Dimonium Chloride Phosphate , Polysorbate 20 , Disodium Cocoyl Glutamate , Citric Acid , Sodium Cocoyl Glutamate , Laureth-2 , Sodium Chloride , Sodium Hydroxide , Sodium Sulfate , Carbomer , Monosodium Citrate , Disodium Edta , Edta , Bht , Phenoxyethanol , Orange 4 (Ci 15510) , Yellow 5 (Ci 19140) , Red 4 (Ci 14700)",1,1,1,1,0
Moisturizer,BIOSSANCE,Squalane + Probiotic Gel Moisturizer,52,4.4,"Water, Squalane, Glycerin, Dimethicone, Pentylene Glycol, Ammonium Acryloyldimethyltaurate/VP Copolymer, Lactococcus Ferment Lysate, Caprylic/Capric Triglyceride, Phenoxyethanol, Caprylyl Glycol, Dimethiconol, Chrondrus Crispus Extract, Allantoin, Bisabolol, Glycine Soja (Soybean) Sterols, Linoleic Acid, Phospholipids, Sodium Phytate, Lechithin, Sodium Hydroxide, Sodium Hyaluronate, Lactic Acid, Lepidium Sativum Sprout Extract, Sodium Chloride, Sodium Benzoate, Citric Acid, Zingiber Officinale (Ginger) Root Extract.",1,1,1,1,1
Moisturizer,IT COSMETICS,Your Skin But Better™ CC+Illumination™ Cream with SPF 50+,38,3.9,"Water, Snail Secretion Filtrate, Titanium Dioxide, Phenyl Trimethicone, Dimethicone, Butylene Glycol, Zinc Oxide, Butylene Glycol Dicaprylate/Dicaprate, Orbignya Oleifera Seed Oil, Butyloctyl Salicylate, Cetyl Peg/Ppg-10/1 Dimethicone, Cyclopentasiloxane, Cyclohexasiloxane, Magnesium Sulfate, Polyglyceryl-4 Isostearate, Dimethicone/Vinyl Dimethicone Crosspolymer, Aluminum Hydroxide, Hexyl Laurate, Stearic Acid, Calcium Stearate, Caprylyl Glycol, Triethoxycaprylylsilane, Ethylhexylglycerin, Citrus Medica Limonum (Lemon) Peel Oil, Tocopheryl Acetate, Sorbitan Isostearate, Phenoxyethanol, Citrus Aurantium Bergamia (Bergamot) Fruit Oil, 1,2-Hexanediol, Disodium Edta, Citrus Aurantium Dulcis (Orange) Peel Oil, Citrus Aurantifolia (Lime) Oil, Vitis Vinifera (Grape) Seed Oil, Punica Granatum Seed Oil, Pinus Sylvestris Leaf Oil, Persea Gratissima (Avocado) Oil, Niacinamide, Citrus Grandis (Grapefruit) Peel Oil, Cholesterol, Anthemis Nobilis Flower Water, Lactobacillus/Honeysuckle Flower/Licorice Root/Morus Alba Root/Pueraria Lobata Root/Schizandra Chinensis Fruit/Scutellaria Baicalensis Root/Sophora Japonica Flower Extract Ferment Filtrate, Perfluorohexane, Olea Europaea (Olive) Leaf Extract, Glycerin, Eucalyptus Globulus Leaf Oil, Camellia Sinensis Leaf Extract, Chrysanthemum Indicum Flower Extract, Pueraria Lobata Root Extract, Perfluorodecalin, Morus Alba Fruit Extract, Magnolia Kobus Bark Extract, Glycine Soja (Soybean) Sprout Extract, Diospyros Kaki Leaf Extract, Cinnamomum Cassia Bark Extract, Artemisia Princeps Leaf Extract, Pentafluoropropane, Curcuma Longa (Turmeric) Root Extract, Steareth-20, Hydrolyzed Hyaluronic Acid, Colloidal Oatmeal, Hydrolyzed Silk, Citric Acid, Sodium Benzoate, Potassium Sorbate, Aloe Barbadensis Leaf Extract, N-Hydroxysuccinimide, Hydrolyzed Collagen, Caprylhydroxamic Acid, Tocopherol, Thiamine Hcl, Riboflavin, Retinyl Palmitate, Pantothenic Acid, Palmitoyl Oligopeptide, Niacin, Folic Acid, Chrysin, Carnitine Hcl, Biotin, Ascorbic Acid, Palmitoyl Tetrapeptide-7, Chlorhexidine Digluconate. [+/-: Mica (Ci 77019), Iron Oxides (Ci 77492, Ci 77491, Ci 77499)].",1,1,1,1,1
Moisturizer,DRUNK ELEPHANT,The Littles™,90,4.4,"Beste™ No.9 Jelly Cleanser: Water, Sodium Lauroyl Methyl Isethionate, Glycerin, Cocamidopropyl Betaine, Cocamidopropyl Hydroxysultaine, Sodium Methyl Oleoyl Taurate, Propanediol, Aloe Barbadensis Leaf Extract, Coco-Glucoside, Lauryl Glucoside, Cucumis Melo Cantalupensis Fruit Extract, Sclerocarya Birrea Seed Oil, Dipotassium Glycyrrhizate, Citric Acid, Phenoxyethanol, Sodium Benzoate, Sodium Chloride. C-Firma™ Day Serum: Water, Ethoxydiglycol, Ascorbic Acid, Glycerin, Laureth-23, Lactobacillus/Pumpkin Ferment Extract, Sclerocarya Birrea Seed Oil, Ferulic Acid, Sodium Hyaluronate, Chondrus Crispus Extract, Camellia Sinensis Leaf Extract, Lactobacillus/Punica Granatum Fruit Ferment Extract, Glycyrrhiza Glabra (Licorice) Root Extract, Vitis Vinifera (Grape) Juice Extract, Phyllanthus Emblica Fruit Extract, Hydrolyzed Wheat Protein, Tocopherol, Caprylhydroxamic Acid, Acetyl Glucosamine, Hydrolyzed Quinoa, Glutamylamidoethyl Imidazole, Dipotassium Glycyrrhizate, Tetrahydrodiferuloylmethane, Tetrahydrodemethoxydiferuloylmethane, Tetrahydrobisdemethoxydiferuloylmethane, Sodium Hyaluronate Crosspolymer, Glycine, Sucrose, Maltodextrin, Propanediol, Caprylyl Glycol, Sodium Hydroxide, Xanthan gum, Hydroxyethyl Acrylate/Sodium Acryloyldimethyl Taurate Copolymer, Isohexadecane, Polysorbate 60. B-Hydra™ Intensive Hydration Serum: Water,Coconut Alkanes, Ammonium Acryloyldimethyltaurate/VP Copolymer, Glycerin, Pentylene Glycol, Sclerocarya Birrea Seed Oil, Wheat Amino Acids, Ananas Sativus (Pineapple) Fruit Extract, Berberis Vulgaris Root Extract, Citrullus Lanatus (Watermelon) Fruit Extract, Lens Esculenta (Lentil) Fruit Extract, Pyrus Malus (Apple) Fruit Extract, Coco-Caprylate/Caprate, Panthenol, Sodium PCA, Sodium Hyaluronate Crosspolymer, Dipotassium Glycyrrhizate, Niacinamide, Cyclodextrin, Sodium Hyaluronate, Sodium Lactate, Phenoxyethanol, Hydroxyproline, Trisodium Ethylenediamine Disuccinate, Citric Acid, Caprylyl Glycol, Chlorphenesin, Ethylhexylglycerin. T.L.C. Framboos™ Glycolic Night Serum: Water, Glycolic Acid, Butylene Glycol, Glycerin, Sodium Hydroxide, Salicylic Acid, Lactic Acid, Citric Acid, Vitis Vinifera (Grape) Juice Extract, Aloe Barbadensis Leaf Juice, Opuntia Ficus-Indica Extract, Aesculus Hippocastanum (Horse Chestnut) Seed Extract, Camellia Sinensis Leaf Extract, Rubus Idaeus (Raspberry) Fruit Extract, Saccharomyces Cerevisiae Extract, Buddleja Davidii Meristem Cell Culture, Sclerocarya Birrea Seed Oil, Sodium Hyaluronate Crosspolymer, Allantoin, Hydroxyethylcellulose, Galactoarabinan, Propanediol, Disodium EDTA, Xanthan Gum, Hexylene Glycol, Phenoxyethanol, Caprylyl Glycol, Ethylhexylglycerin, Sodium Nitrate, Potassium Sorbate, Pentylene Glycol, Sodium Benzoate. Virgin Marula Luxury Facial Oil: Sclerocarya Birrea Seed OilLala Retro™Whipped CreamWater,Glycerin, Caprylic/ Capric Triglyceride, Isopropyl Isostearate, Pseudozyma Epicola/Camellia Sinensis Seed Oil/Glucose/Glycine Soja Meal/Malt Extract/Yeast Extract Ferment Filtrate (Pseudozyma Epicola/Camellia Sinensis Seed Oil/Glucose/Yeast Extract Ferment Filtrate), Stearic Acid, Glyceryl Stearate SE, Cetearyl Alcohol, Pentylene Glycol, Plantago Lanceolata Leaf Extract, Adansonia Digitata Seed Oil, Citrullus Lanatus (Watermelon) Seed Oil, Passiflora Edulis Seed Oil, Schinziophyton Rautanenii Kernel Oil, Sclerocarya Birrea Seed Oil, Polyglyceryl-6 Ximenia Americana Seedate, Sodium Hyaluronate Crosspolymer, Ceteareth-20, Trisodium Ethylenediamine Disuccinate, Sodium Hydroxide, Citric Acid, Carbomer, Xanthan Gum, Caprylyl Glycol, Chlorphenesin, Phenoxyethanol, Ethylhexylglycerin. Umbra™ Sheer Physical Daily Defense SPF 30: Zinc Oxide 20%, Water, Caprylic/Capric Triglyceride, Dicaprylyl Carbonate, Glycerin,Pentylene Glycol, Steareth-2, Propanediol, Steareth-21, Polyhydroxystearic Acid, Cetearyl Alcohol, Silica, Sclerocarya Birrea Seed Oil, Aloe Barbadensis Leaf Extract, Chondrus Crispus Extract, Haematococcus Pluvialis Extract, Helianthus Annuus (Sunflower) Sprout Extract, Vitis Vinifera (Grape) Juice Extract, Helianthus Annuus (Sunflower) Seed Oil, Simmondsia Chinensis (Jojoba) Seed Oil, Raspberry Seed Oil/Tocopheryl Succinate Aminopropanediol Esters, Hydrolyzed Wheat Protein,Tocopheryl Acetate, Tocopherol, Sea Water, Acetyl Glucosamine, Cetearyl Glucoside, Sodium Stearoyl Glutamate, Tetrahexyldecyl Ascorbate, Glycine, Sucrose, Lecithin, Triethoxycaprylylsilane, Xanthan Gum, Trisodium Ethylenediamine Disuccinate, Caprylhydroxamic Acid, Mica, Caprylyl Glycol, Phenoxyethanol, Titanium Dioxide (CI 77891), Iron Oxides (CI 77491). Shaba Complex™ Eye Serum: Water, Octyldodecanol, Glycerin, Boron Nitride, Saccharomyces/Xylinum/Black Tea Ferment, Coconut Alkanes, Cetyl Alcohol, Cetearyl Olivate, Sorbitan Olivate, Niacinamide, Copper Tripeptide-1, Leontopodium Alpinum Meristem Cell Culture, Dipeptide-2, Palmitoyl Tripeptide-1, Palmitoyl Tetrapeptide-7, Copper Lysinate/Prolinate, Hesperidin Methyl Chalcone, Chondrus Crispus (Carrageenan), Mangifera Indica (Mango) Seed Butter, Glycine Soja (Soybean) Oil, Hippophae Rhamnoides Oil, Sclerocarya Birrea Seed Oil, Sodium Hyaluronate Crosspolymer, Hydroxyethylcellulose, Coco-Caprylate/Caprate, Steareth-20, Lecithin, Panthenol, N-Hydroxysuccinimide, Ubiquinone, Citric Acid, Thioctic Acid, Tocopherol, Chrysin, Sclerotium Gum, Methylglucoside Phosphate, Xanthan Gum, Potassium Sorbate, Sodium Benzoate, Chlorphenesin, Caprylyl Glycol, Sodium Hydroxide, Phenoxyethanol, Pentylene Glycol, Ethylhexylglycerin.",1,1,1,1,0
Eye cream,SHISEIDO,Ibuki Eye Correcting Cream,40,3.8,"Water, Dimethicone, Alcohol Denat., Glycerin, Butylene Glycol, Dipropylene Glycol, Polymethylsilsesquioxane, Diphenylsiloxy Phenyl Trimethicone, Peg-10 Dimethicone, Disteardimonium Hectorite, Titanium Dioxide (Ci 77891), Pentaerythrityl Tetraethylhexanoate, Trehalose, Peg-150, Isostearic Acid, Mica, Disodium Edta, Alcohol, Fragrance, Betaine, Tocopheryl Acetate, Sodium Citrate, Tin Oxide, Aluminum Hydroxide, Limonene, Citric Acid, Menthol, Hexyl Cinnamal, Butylphenyl Methylpropional, Hydrogen Dimethicone, Polysilicone-2,Iron Oxides (Ci 77491), Benzyl Benzoate, Linalool, Talc, Citronellol, Lamium Album Flower Extract, Citrus Junos Seed Extract, Houttuynia Cordata Extract, Tocopherol, Dimethicone/Methicone Copolymer, Zingiber Aromaticus Extract.",0,0,0,0,0
Face Mask,KATE SOMERVILLE,Wrinkle Warrior® Pink Plumping Mask,56,4.0,"Water, Propanediol, Glycerin, Pyrus Malus (Apple) Fruit Extract, Hydrolyzed Hyaluronic Acid, Sodium Hyaluronate, Methylglucoside Phosphate, Copper Lysinate/Prolinate, Disodium Acetyl Glucosamine Phosphate, Chondrus Crispus Extract, Adenosine, Gluconolactone, Carbomer, 1,2-Hexanediol, Sodium Hydroxide, Caprylhydroxamic Acid, Disodium EDTA, PEG-40 Hydrogenated Castor Oil, PPG-26-Buteth-26, Calcium Sodium Borosilicate, Fragrance (Parfum), Sodium Benzoate, Phenoxyethanol, Titanium Dioxide (CI 77891), Tin Oxide (CI 77861), Red 40 (CI 16035), Red 33 (CI 17200).",1,1,1,1,0
Face Mask,DIOR,Hydra Life Extra Plump Smooth Balm Mask,69,4.6,-Natural White Pine Oil: Comforts and soothes. -Balanced Botanical Blend Including Shea butter and Jojoba: Nourishes the skin.,1,1,1,0,0
Eye cream,INDIE LEE,I-Waken Eye Serum,48,3.8,"Water, Propanediol, Glycerin, Alcohol, Dicaprylyl Ether, Polyglyceryl-6 Distearate, Caprylic/Capric Triglyceride, Sodium Levulinate, Sclerotium Gum, Simmondsia Chinensis (Jojoba) Seed Oil, Squalane, Jojoba Esters, Chondrus Crispus, Sodium Anisate, Pyrus Sorbus Bud Extract, Sodium Dehydroacetate, Cetyl Alcohol, Polyglyceryl-3 Beeswax, Sodium Hyaluronate, Galactaric Acid, Tocopherol, Citric Acid, Aesculus Hippocastanum (Horse Chestnut) Seed Extract, Arnica Montana Flower Extract, Centaurea Cyanus Flower Extract, Chamomilla Recutita (Matricaria) Flower Extract, Hamamelis Virginiana (Witch Hazel) Leaf Extract, Ribes Nigrum (Black Currant) Leaf Extract, Spirulina Maxima Extract, Helianthus Annuus (Sunflower) Seed Oil.",1,1,1,1,1
Face Mask,SEPHORA COLLECTION,Sleeping Mask - Rose,4,4.3,"Water, Butylene Glycol, Glycerin, Betaine, Phenoxyethanol, Acrylates/C10-30 Alkyl Acrylate Crosspolymer, Caprylic/Capric Triglyceride, Dimethicone, Peg-40 Hydrogenated Castor Oil, Isononyl Isononanoate, Tremella Fuciformis (Mushroom) Extract, Sodium Hydroxide, Ethylhexylglycerin, Rosa Damascena Extract, Fragrance, Sodium Hyaluronate, CI 14700 (Red 4), CI 42090 (Blue 1).",0,0,0,0,0
Treatment,KATE SOMERVILLE,EradiKate® Salicylic Acid Acne Treatment,58,4.6,"Water, Glycereth-7 Trimethyl Ether, Cetyl Alcohol, Caprylic/Capric Triglyceride, Isopropyl Isostearate,Trimethylolpropane Tricaprylate/Tricaprate, Steareth-21, Dimethicone, Glycereth-18 Ethylhexanoate, Propanediol, Steareth-2, Retinyl Propionate, Hexylresorcinol, Oligopeptide-10, Proline, Hydroxyproline, Ethyl Linoleate, Sodium Hyaluronate, Saccharide Isomerate, Sodium PCA, Panthenol, Melaleuca Alternifolia Leaf Oil, Laminaria Digitata Extract, Boswellia Serrata Extract, Honey Extract, Oryza Sativa (Rice) Bran Extract, Chlorella Vulgaris Extract, Sea Water, Glycerin, Butylene Glycol, Glycereth-18, Trimethylpentanediol/Adipic Acid Copolymer, 1,2-Hexanediol, Polyacrylate Crosspolymer-6, Polymethylsilsesquioxane/Silica Crosspolymer, Aminomethyl Propanol, Caprylhydroxamic Acid, Disodium EDTA, Phenoxyethanol, Sodium Benzoate, Ethylhexylglycerin, Lavandula Angustifolia (Lavender) Oil, Disodium Carboxyethyl Siliconate, T-Butyl Alcohol, Linalool, Limonene, Iron Oxides (Ci 77491).",1,0,1,0,0
Cleanser,DERMADOCTOR,"Kakadu C™ Brightening Daily Cleanser with Vitamins C, A & AHAs",36,3.9,"Aloe Barbadensis Leaf Extract, Decyl Glucoside, Glycerin, Lactic Acid, Hamamelis Virginiana (Witch Hazel) Extract, Sorbitol, Xanthan Gum, Sodium Hyaluronate, Malic Acid, Propyl Gallate, Aqua (Water), Gallyl Glucoside, Epigallocatechin Gallatyl Glucoside, Terminalia Ferdinandiana (Kakadu Plum) Fruit Extract, Prunus Armeniaca (Apricot) Fruit Extract, Aniba Rosaeodora (Rosewood) Wood Extract, Citrus Aurantifolia (Lime) Peel Extract, Citrus Aurantium Dulcis (Orange) Peel Extract, Vanilla Planifolia Fruit Extract, Citrus Grandis (Grapefruit) Peel Extract, Mangifera Indica (Mango) Fruit Extract, Cocos Nucifera (Coconut) Oil, Magnesium Ascorbyl Phosphate, Tocopheryl Acetate, Retinyl Palmitate, Sodium Phytate, Phenoxyethanol, Ethylhexylglycerin.",0,0,0,0,0
Cleanser,TATA HARPER,Nourishing Oil Cleanser,76,4.1,*Ingredients from organic farming. **Clinical grade essential oils blend.,1,1,1,1,1
