Label,Brand,Name,Price,Rank,Ingredients,Combination,Dry,Normal,Oily,Sensitive
Moisturizer,SK-II,GenOptics Aura Essence Serum,240,4.1,"Water, Galactomyces Ferment Filtrate (Pitera), Niacinamide, Butylene Glycol, Triethylhexanoin, Pentylene Glycol, Glycerin, Nylon-12, Phytosteryl/Octyldodecyl Lauroyl Glutamate, Polymethylsilsesquioxane, Boron Nitride, Panthenol, PEG-20 Sorbitan Cocoate, Inositol, Caprylic/Capric Triglyceride, Mica, Phenoxyethanol, Acrylates/C10-30 Alkyl Acrylate Crosspolymer, PEG-11 Methyl Ether Dimethicone, Polyacrylamide, Aminomethyl Propanol, Undecylenoyl Phenylalanine, Benzyl Alcohol, C13-14 Isoparaffin, Disodium EDTA, Hydrolyzed Prunus Domestica, Xanthan Gum, Sodium Benzoate, Hexyldecanol, Laureth-7, Citrus Reticulata Peel Extract/Citrus Reticulata (Tangerine) Peel Extract, Methylparaben, Ascorbyl Glucoside, Prunus Mume Fruit Extract, Tocopherol, Fragrance, Limonene, Citronellol, Linalool, Geraniol, Ci 77891 (Titanium Dioxide).",1,1,1,1,1
Cleanser,MURAD,Essential-C Toner,30,4.4,"Water, Butylene Glycol, Witch Hazel Water, PEG-40 Hydrogenated Castor Oil, Sodium PCA, Betaine, Sorbitol, Glycine, Alanine, Proline, Serine, Threonine, Arginine, Lysine, Glutamic Acid, Rice Amino Acids, Zinc Aspartate, Dipotassium Glycyrrhizate, PEG-12 Dimethicone, Phospholipids, Tocopheryl Acetate, Retinyl Palmitate, Ascorbyl Palmitate, Ascorbic Acid, Chitosan, Propyl Gallate, Bitter Orange Flower Extract, Echinacea Purpurea Extract, Orange Fruit Extract, Sodium Polyaspartate, Benzophenone-4, Polyquaternium-4, Disodium EDTA, Citric Acid, Phenoxyethanol, Caprylyl Glycol, Chlorphenesin, Limonene, Linalool, Orange Peel Oil, Mandarin Orange Peel Oil, Basil Oil, Grapefruit Peel Oil, Galbanum Resin Oil, Fragrance, Green 3 (CI 42053).",0,0,0,0,0
Moisturizer,FRESH,Seaberry Moisturizing Face Oil,52,4.4,"Vitis Vinifera (Grape) Seed Oil, Camellia Oleifera Seed Oil, Prunus Amygdalus Dulcis (Sweet Almond) Oil, Hippophae Rhamnoides Oil, Ros- marinus Officinalis (Rosemary) Leaf Extract, Vaccinium Macrocarpon (Cran- berry) Seed Oil, Tocopheryl Acetate, Tocopherol, Ascorbyl Tetraisopalmitate, Parfum (Fragrance), BHT, Linalool, Limonene, Citral, Coumarin, Geraniol.",0,0,0,0,0
Face Mask,SATURDAY SKIN,Spotlight Brightening Mask,6,4.6,"Saccharomyces Ferment, Water, Methylpropanediol, 1,2-Hexanediol, Alcohol, Glycerin, Dipropylene Glycol, Butylene Glycol, Vaccinium Vitis-Idaea Leaf Extract, Glycyrrhiza Glabra (Licorice) Root Extract, Nelumbo Nucifera Flower Extract, Citrus Medica Limonum (Lemon) Peel Oil, Juniperus Mexicana Oil, Lavandula Angustifolia (Lavender) Oil, Rosmarinus Officinalis (Rosemary) Leaf Oil, Eucalyptus Globulus Leaf Oil, Citrus Aurantium Dulcis (Orange) Peel Oil, Citrus Grandis (Grapefruit) Peel Oil, Hydrogenated Lecithin, Cholesterol, sh-Polypeptide-1, sh-Polypeptide-8, sh-Polypeptide-9, sh-Polypeptide-45, sh-Polypeptide-22, sh-Oligopeptide-1, sh-Oligopeptide-2, PEG-800, Polysorbate 20, Carbomer, Disodium EDTA, Potassium Hydroxide, Ethylhexylglycerin.",1,1,1,1,1
Moisturizer,HERBIVORE,Lapis Oil Balancing Facial Oil,72,4.4,"Amaranthus Squalane Oil, Simmondsia Chinensis (Jojoba) Seed Oil, Capric Triglycerides (Fractionated Coconut Oil), Aleurites Moluccana (Kukui) Nut Oil, Tocopherol (Vitamin E), Tanacetum Annuum (Blue Tansy) Leaf Oil, Jasminum Sambac (Jasmine) Absolute, Rosa Damascena (Moroccan Rose) Absolute.",1,0,1,1,0
Eye cream,ORIGINS,Eye Doctor™ Moisture Care For Skin Around Eyes,41,4.1,"Water, Butylene Glycol, Myristyl Myristate, Caprylic/Capric Triglyceride, Squalane, Glyceryl Stearate, Tricaprylin, Peg-4 Dilaurate, Cetyl Alcohol, Citrus Limon (Lemon) Peel Oil*, Cucumis Sativus (Cucumber) Oil*, Ferula Galbaniflua (Galbanum) Resin Oil*, Benzyl Salicylate, Centella Asiatica (Hydrocotyl) Extract, Camellia Sinensis (Green Tea) Leaf Extract, Gigartina Stellata (Algae) Extract, Hypnea Musciformis (Algae) Extract, Triticum Vulgare (Wheat) Germ Extract, Cucumis Sativus (Cucumber) Fruit Extract, Hordeum Vulgare (Barley) Extract/Extrait D'Orge, Gellidiela Acerosa (Algae) Extract, Rosmarinus Officinalis (Rosemary) Leaf Extract, Panax Ginseng (Ginseng) Root Extract, Tocopheryl Linoleate/Oleate, Caffeine, Ethylhexylglycerin, Magnesium Ascorbyl Phosphate, Cetyl Ricinoleate, Bifida Ferment Lysate, Sodium Hyaluronate, Peg-100 Stearate, Steareth-20, Bis-Peg-18 Methyl Ether Dimethyl Silane, Glycerin, Dimethicone, Carbomer, Cetearyl Alcohol, Caprylyl Glycol, Potassium Hydroxide, Polysorbate 60, Hexylene Glycol, Disodium Edta, Bht, Phenoxyethanol * Essential Oil Please be aware that ingredient lists may change or vary from time to time.� Please refer to the ingredient list on the product package you receive for the most up to date list of ingredients.",0,0,0,0,0
Treatment,LANCÔME,Advanced Génifique Youth Activating Serum Duo,178,2.0,"Water, Bifida Ferment Lysate, Glycerin, Alcohol Denat., Dimethicone, Hydroxyethylpiperazine Ethane Sulfonic Acid, Ascorbyl Glucoside, Sodium Hyaluronate, Sodium Hydroxide, Sodium Benzoate, Phenoxyethanol, Adenosine, Faex Extract/Yeast Extract/Extrait De Levure, Peg-20 Methyl Glucose Sesquistearate, Peg-60 Hydrogenated Castor Oil, Salicyloyl Phytosphingosine, Ammonium Polyacryldimethyltauramide/Ammonium Polyacryloyldimethyl Taurate, Limonene, Xanthan Gum, Caprylyl Glycol, Disodium Edta, Octyldodecanol, Citronellol, Fragrance.",0,0,0,0,0
Eye cream,ORIGINS,GinZing™ Refreshing Eye Cream to Brighten and Depuff,32,4.0,"Water, Methyl Trimethicone, Butylene Glycol, Peg-100 Stearate, Dimethicone, Cetyl Ricinoleate, Silica, Olea Europaea (Olive) Fruit Oil, Glycerin, Behenyl Alcohol, Cucumis Sativus (Cucumber) Fruit Extract, Panax Ginseng (Ginseng) Root Extract, Castanea Sativa (Chestnut) Seed Extract, Camellia Sinensis (Green Tea) Leaf Extract, Cordyceps Sinensis Extract, Magnolia Officinalis Bark Extract, Pyrus Malus (Apple) Fruit Extract, Scutellaria Baicalensis Root Extract, Pantethine, Panthenol, Caprylic/Capric Triglyceride, Butyrospermum Parkii (Shea Butter), Caffeine, Coleus Barbatus Extract, Yeast Extract\Faex\Extrait De Levure, Folic Acid, Hydrogenated Lecithin, Jojoba Wax Peg-120 Esters, Biotin, Tribehenin, Myristyl Alcohol, Palmitoyl Tetrapeptide-7, Trehalose, Sodium Hyaluronate, Ascorbyl Tocopheryl Maleate, Hesperidin Methyl Chalcone, Sodium Sulfite, Sodium Metabisulfite, Steareth-20, Dipeptide-2, Ethylhexylglycerin, Carbomer, Tromethamine, Sorbic Acid, Chlorphenesin, Phenoxyethanol, Mica, Titanium Dioxide (Ci 77891), Iron Oxides (Ci 77491, Ci 77492, Ci 77499).",1,1,1,1,1
Sun protect,CLINIQUE,Age Defense BB Cream Broad Spectrum SPF 30,39,3.9,Visit the CLINIQUE boutique,0,0,0,0,0
Face Mask,FARMACY,Bright On Massage-Activated Vitamin C Mask with Echinacea GreenEnvy™,38,4.6,"Water, Aloe Barbadensis Leaf Juice, Kaolin, Glycerin, Bentonite, Pyrus Malus (Apple) Fruit Extract, Propanediol, Titanium Dioxide (Ci 77891), Sorbitol, 1,2-Hexanediol, Lauroyl Lysine, Chromium Oxide Greens, Maltooligosyl Glucoside, Xanthan Gum, Echinacea Purpurea Root Extract, Ascorbyl Tetraisopalmitate, Ascorbic Acid, Citrus Aurantium Dulcis (Orange) Fruit Extract, Citrus Limon (Lemon) Fruit Extract, Citrus Aurantifolia (Lime) Oil, Vaccinium Myrtillus Fruit/Leaf Extract, Vaccinium Angustifolium (Blueberry) Fruit Extract, Lavandula Angustifolia (Lavender) Oil, Acer Saccharum (Sugar Maple) Extract, Centella Asiatica Extract, Saccharum Officinarum (Sugarcane) Extract, Glycyrrhiza Glabra (Licorice) Root Extract, Lavandula Hybrida Oil, Rosmarinus Officinalis (Rosemary) Leaf Extract, Cucumis Sativus (Cucumber) Fruit Extract, Brassica Oleracea Acephala Leaf Extract, Brassica Oleracea Italica (Broccoli) Extract, Camellia Sinensis Leaf Extract, Mentha Piperita (Peppermint) Oil, Rosmarinus Officinalis (Rosemary) Leaf Oil, Citrus Aurantium Dulcis (Orange) Peel Oil, Anthemis Nobilis Flower Oil, Chamomilla Recutita (Matricaria) Flower Extract, Aloe Barbadensis Leaf Extract, Tocopherol, Betaine, Zingiber Officinale (Ginger) Root Oil, Hydrogenated Starch Hydrolysate, Perilla Ocymoides Seed Oil, Helianthus Annuus (Sunflower) Seed Oil, Trisodium Ethylenediamine Disuccinate, Citrus Aurantium Bergamia (Bergamot) Fruit Oil, Cananga Odorata Flower Oil, Cymbopogon Martini Oil, Pelargonium Graveolens Oil, Pogostemon Cablin Oil, Sclerotium Gum, Pullulan, Polygonum Cuspidatum Root Extract, Scutellaria Baicalensis Root Extract, Abies Sibirica Oil, Cellulose Gum, Sucrose, Mica, Pentaerythrityl Tetra-Di-T-Butyl Hydroxyhydrocinnamate, Potassium Sorbate, Ethylhexylglycerin, Manganese Violet, Polyglyceryl-10 Laurate, Cellulose Acetate Butyrate, Caprylic/Capric Triglyceride, Citric Acid, Polyglyceryl-10 Myristate, Acrylates Copolymer, Sodium Benzoate, Algin, Bioflavonoids, Limonene, Linalool.",1,1,1,1,1
Cleanser,MURAD,Hydro-Dynamic® Quenching Essence,78,4.3,"Glycerin, Glycolic Acid, Yeast Extract, Phenoxyethanol, Ethylhexylglycerin Glycerin, Citrullus Lanatus (Watermelon) Fruit Extract, Pyrus Malus (Apple) Fruit Extract, Lens Esculenta (Lentil) Fruit Extract, Sodium PCA, Sodium Lactate Urea, Yeast Amino Acids, Trehalose, Inositol, Taurine, Betaine Tocopheryl Acetate Ascorbic Acid, Chitosan, Zinc Gluconate. Glycerin, Glycolic Acid, Yeast Extract, Phenoxyethanol, Ethylhexylglycerin Glycerin, Citrullus Lanatus (Watermelon) Fruit Extract, Pyrus Malus (Apple) Fruit Extract, Lens Esculenta (Lentil) Fruit Extract, Sodium PCA, Sodium Lactate Urea, Yeast Amino Acids, Trehalose, Inositol, Taurine, Betaine Tocopheryl Acetate Ascorbic Acid, Chitosan, Zinc Gluconate.",1,1,1,1,1
Face Mask,LANCÔME,Energie de Vie Glow Boosting Mini Mask Trio,39,5.0,Visit the Lancôme boutique,1,1,1,1,1
Cleanser,BELIF,Problem Solution Toner,28,4.3,"Water, Dipropylene Glycol, Butylene Glycol, 1,2-Hexanediol, Glycerin, Melaleuca Alternifolia (Tea Tree) Leaf Oil, Calendula Officinalis Flower Extract*+, Avena Sativa (Oat) Kernel Extract*, Nepeta Cataria Extract*, Rubus Idaeus (Raspberry) Leaf Extract*, Baptisia Tinctoria Root Extract*, Stellaria Media (Chickweed) Extract*, Arctium Lappa Root Extract+, Echinacea Angustifolia Extract+, Rosmarinus Officinalis (Rosemary) Leaf Extract+, Lavandula Angustifolia (Lavender) Flower Extract+, Lactobacillus/Soybean Ferment Extract, Saccharomyces/Potato Extract Ferment Filtrate, Saccharomyces/Barley Seed Ferment Filtrate, Centella Asiatica Extract, Glycyrrhiza Glabra (Licorice) Root Extract, Camellia Sinensis Leaf Extract, Scutellaria Baicalensis Root Extract, Polygonum Cuspidatum Root Extract, Chamomilla Recutita (Matricaria) Flower Extract, Glycine Soja (Soybean) Sprout Extract, Magnolia Kobus Bark Extract, Sodium Hyaluronate, Panthenol, Alanyl Glutamine, PEG-40 Hydrogenated Castor Oil, Octyldodeceth-16, Citric Acid, Sodium Citrate, Trisodium EDTA, Sodium Polyacrylate, Citrus Aurantium Bergamia (Bergamot) Fruit Oil, Eucalyptus Globulus Leaf Oil, Rosmarinus Officinalis (Rosemary) Leaf Oil, Fragrance**, Citral, Citronellol, Limonene, Geraniol, Linalool.",0,0,0,1,1
Face Mask,SEPHORA COLLECTION,Hand Mask - Avocado,5,3.7,"Water, Glycerin, Butylene Glycol, Carthamus Tinctorius (Safflower) Seed Oil, Urea, Glyceryl Stearate, Cetearyl Alcohol, Propylene Glycol, Persea Gratissima (Avocado) Fruit Extract, PEG-100 Stearate, Fragrance, Phenoxyethanol, Dimethicone, Arginine, Carbomer, Caprylyl Glycol, 1,2-Hexanediol, Propanediol, Butyrospermum Parkii Butter Extract (Butyrospermum Parkii (Shea Butter) Extract), Disodium EDTA, Linalool, Tocopheryl Acetate, Citronellol, Illicium Verum (Anise) Fruit Extract, Hydroxycitronellal, Sodium Hyaluronate, Geraniol, Alpha-Isomethyl Ionone.",0,0,0,0,0
Face Mask,ALGENIST,Algae Brightening Mask,62,0.0,"Water, Kaolin, Bentonite, Ilite, Macrocystis Pyrifera Extract, Caprylic/Capric Triglyceride, Titanium Dioxide (CI 77891), Glycerin, Cetyl Alcohol, Isopropyl Isostearate, Silt, Cetearyl Alcohol, Glyceryl Stearate, PEG-100 Stearate, Butylene Glycol, Sorbitan Stearate, Algae Exopolysaccharides, Algae Extract, Alaria Esculenta Extract, Haematococcus Pluvialis Extract, Sea Water, Salicylic Acid, Lactic Acid, Glucosamine HCl, Saccharomyces Cerevisiae Extract, Saccharum Officinarum (Sugar Cane) Extract, Camellia Oleifera Leaf Extract, Chamomilla Recutita (Matricaria) Flower Extract, Cucumis Sativus (Cucumber) Fruit Extract, Citrus Medica Limonum (Lemon) Fruit Extract, Citrus Aurantium (Orange) Fruit Extract, Pyrus Malus (Apple) Fruit Extract, Caprylyl Glycol, Hydrogenated Lecithin, Hexylene Glycol, Ethylhexylglycerin, Sodium Hydroxide, Urea, PEG-12 Dimethicone, Sodium Benzoate, Potassium Sorbate, Disodium EDTA, Phenoxyethanol, Fragrance, Chromium Oxide Green.",0,0,0,0,0
Treatment,FIRST AID BEAUTY,Skin Rescue Acne Clearing Pads with White Clay,30,4.2,"Water, Polysorbate 80, Phenoxyethanol, Sodium Hydroxide, Glycerin, Sodium Citrate, Kaolin, Salix Nigra (Willow) Bark Extract, Butylene Glycol, Rosmarinus Offici-nalis (Rosemary) Leaf Essential Oil, Potassium Sorbate, Sodium Benzoate, Camellia Sinensis Leaf Extract, Chrysanthemum Parthenium (Feverfew) Extract, Glycyrrhiza Gla-bra (Licorice) Root Extract, Capryloyl Glycine, Hexylene Glycol, Symphytum Officinale Leaf Extract, Melaleuca Alternifolia (Tea Tree) Leaf Oil, Sarcosine, Leuconostoc/Radish Root Ferment Filtrate, Enantia Chlorantha Bark Extract, Epilobium Angustifolium Flow-er/Leaf/Stem Extract, Cinnamomum Zeylanicum Bark Extract, Xanthan Gum, d-Limonene, Oleanolic Acid.",1,1,1,1,1
Cleanser,FRESH,Rose Floral Toner Mini,15,2.8,"Water, Gly- cerin, Pentylene Glycol, Rosa Dama- scena Flower Water, Anthemis Nobilis Flower Oil, Sodium Citrate, Citric Acid, Citronellol, Geraniol, Pheno- Xyethano.",0,0,0,0,0
Eye cream,PHILOSOPHY,Hope In A Tube Eye & Lip Cream,38,4.2,"Water, Squalane, Glycerin, Paraffinum Liquidum/Mineral Oil/Huile Minerale, Isocetyl Stearoyl Stearate, Butylene Glycol, Petrolatum, Polyglyceryl-2 Diisostearate, Peg-30 Dipolyhydroxystearate, Paraffin, Magnesium Sulfate, Phytosteryl/Octyldodecyl Lauroyl Glutamate, Tocopherol, Tocopheryl Acetate, Potassium Ascorbyl Tocopheryl Phosphate, Dipalmitoyl Hydroxyproline, Lecithin, Adenosine, Bisabolol, Microcristallina Cera/Microcrystalline Wax/Cire Microcrystalline, Polyethylene, Polyaminopropyl Biguanide, Polysorbate 80, Disodium Edta, Benzyl Alcohol, Farnesol, Triethoxycaprylylsilane, Chlorphenesin, Bht, Iron Oxides (Ci 77491, Ci 77492, Ci 77499).",0,0,0,0,0
Moisturizer,SUNDAY RILEY,U.F.O. Ultra-Clarifying Face Oil,80,4.2,"Silybum Marianum (Milk Thistle) Seed Oil, Nigella Sativa (Black Cumin) Seed Oil, Cucumis Sativus (Cucumber) Seed Oil, Diisopropyl Sebacate, Punica Granatum (Pomegranate) Seed Oil, Vaccinium Macrocarpon (Cranberry) Seed Oil, Dimethyl Isosorbide, Linum Usitatissimum (Flax) Seed Oil, Caprylic/Capric Triglycerides, Ethyl Linoleate, Hexylresorcinol, Glycyrrhiza Glabra (Licorice) Root Extract, Salicylic Acid, Prunus Armeniaca (Apricot) Kernel Oil, Chamomilla Recutita Flower Oil, Citrus Aurantium Amara (Neroli) Flower Oil, Melaleuca Alternifolia (Tea Tree) Leaf Oil, Helianthus Annuus Seed Oil, Rosmarinus Officinalis (Rosemary) Leaf Extract, Citrus Paradisii (Grapefruit) Peel Oil, Melia Azadirachta (Neem) Leaf Extract, Melia Azadirachta (Neem) Flower Extract, Coccinia Indica Fruit Extract, Amino Esters-1, Amber Leaf Extract, Solanum Melongena (Eggplant) Fruit Extract, Aloe Barbadensis Flower Extract, Lawsonia Inermis (Henna) Extract, Ocimum Sanctum Leaf Extract, Ocimum Basilicum (Basil) Leaf Extract, Curcuma Longa (Turmeric) Root Extract, Corallina Officinalis Extract, Simmondsia Chinensis (Jojoba) Seed Oil, Pearl Powder, Moringa Pterygosperma Seed Oil.",1,1,1,1,1
Moisturizer,TATCHA,The Silk Cream,120,4.3,"Water, Saccharomyces/Camellia Sinensis Leaf/Cladosiphon Okamuranus/Rice Ferment Filtrate*, Glycerin, Propanediol, Cyclopentasiloxane, Squalane, Isononyl Isononanoate, Inositol, Sericin, Hydrolyzed Silk, Hydrolyzed Conchiolin Protein, Rubus Ellipticus Root Extract, Oryza Sativa (Rice) Germ Oil, Panax Ginseng Root Extract, Royal Jelly Extract, Thymus Serpyllum Extract, Caprylic/Capric Triglyceride, Sorbitan Stearate, Behenyl Alcohol, Stearic Acid, Hydrogenated Lecithin, Polyglyceryl-2 Triisostearate, Batyl Alcohol, Ethylhexylglycerin, Arginine, Bis-Behenyl/Isostearyl/Phytosteryl Dimer Dilinoleyl Dimer Dilinoleate, Carbomer, Xanthan Gum, Biosaccharide Gum-1, Sodium Hyaluronate, Parfum/Fragrance, Butylene Glycol, Alcohol, Phenoxyethanol. *Hadasei-3.",1,1,1,0,1
Moisturizer,FRESH,Black Tea Firming Overnight Mask,92,4.1,"Water, Glycerin, Butylene Glycol, Jojoba Esters, Isohexadecane, Ammonium Acryloyldimethyltaurate/Vp Copolymer, Dicaprylyl Carbonate, Camellia Oleifera Seed Oil, Pentylene Glycol, Ethylhexyl Palmitate, Mirabilis Jalapa Extract, Glyceryl Stearate, Steareth-21, Caprylic/Capric Triglyceride, Dimethicone, Oxidized Corn Oil, Butyrospermum Parkii (Shea Butter), Cera Alba (Beeswax), Kigelia, Africana Fruit Extract, Saccharomyces Ferment Filtrate, Camellia Sinensis Leaf Extract, Rubus Fruticosus (Blackberry) Leaf Extract, Litichi Chinensis Seed Extract, Rosa Damascena Flower Oil, Sodium Hyaluronate, Adenosine, Tocopheryl Acetate, Tocopherol, Ceteareth-20, Behenyl Alcohol, Fragrance, Ceteareth-12, Cetearyl Alcohol, Sodium Citrate, Sodium Polyacrylate Starch, Sodium Polyacrylate, Sorbitan Laurate, Disodium Edta, Maltodextrin, Silica, Tetrasodium Edta, Hydroxyethylcellulose, Acetyl Dipeptide-1 Cetyl Ester, Citric Acid, Ci 77891 (Titanium Dioxide), BHT, Potassium Sorbate, Biotin, Phenoxyethanol, Linalool, Citronellol, Geraniol.",1,1,1,0,0
Sun protect,ESTÉE LAUDER,DayWear UV Base Advanced Anti-Oxidant & UV Defense SPF 50,44,4.2,"Daywear Adv Mt-Prt Ao&Uv Def Spf50 Division: El (Estee Lauder)Active Ingredients: Avobenzone 3.00% , Homosalate 5.00% , Octisalate 5.00% , Octocrylene 2.70% , Oxybenzone 3.00%Ingredients: Water , Butyloctyl Salicylate , Methyl Trimethicone , Neopentyl Glycol Diheptanoate , Aleurites Moluccana (Kukui) Seed Oil , Lauryl Peg-9 Polydimethylsiloxyethyl Dimethicone , Peg-100 Stearate , Butylene Glycol , Glyceryl Stearate , Dipentaerythrityl Tri-Polyhydroxystearate , Potassium Cetyl Phosphate , Gentiana Lutea (Gentian) Root Extract , Polygonum Cuspidatum Root Extract , Hordeum Vulgare (Barley) Extract/Extrait D'Orge , Triticum Vulgare (Wheat) Germ Extract , Fumaria Officinalis Flower/Leaf/Stem Extract , Citrus Medica Limonum (Lemon) Fruit Extract , Hydrolyzed Rice Bran Extract , Hydrolyzed Rice Extract , Rosmarinus Officinalis (Rosemary) Leaf Extract , Vitis Vinifera (Grape) Seed Extract , Artemia Extract , Laminaria Ochroleuca Extract , Algae Extract , Hydrogenated Lecithin , Thermus Thermophillus Ferment , Squalane , Glycerin , Sorbitol , Linoleic Acid , Caffeine , Cholesterol , Ethylhexylglycerin , Lecithin , Ergothioneine , Sodium Hyaluronate , Polyquaternium-51 , Cetyl Alcohol , Trehalose , Palmitoyl Hydroxypropyltrimonium Amylopectin/Glycerin Crosspolymer , Ammonium Acryloyldimethyltaurate/Vp Copolymer , Vp/Eicosene Copolymer , Tetrahexyldecyl Ascorbate , Saccharide Isomerate , Caprylyl Glycol , Caprylic/Capric Triglyceride , Sodium Pca , Cyclodextrin , Urea , Dehydroxanthan Gum , Tocopheryl Acetate , Glycyrrhetinic Acid , Nordihydroguaiaretic Acid , Ascorbyl Tocopheryl Maleate , Citric Acid , Stearic Acid , Sodium Dehydroacetate , Fumaric Acid , Ethylbisiminomethylguaiacol Manganese Chloride , Silica , Phenoxyethanol , Disodium Edta , Bht , Fragrance , Mica , Titanium Dioxide (Ci 77891) , Blue 1 (Ci 42090) , Yellow 5 (Ci 19140)",0,0,0,0,0
Cleanser,LAURA MERCIER,Flawless Skin Face Polish,32,4.7,"Aqua (Water), Polyethylene, Butylene Glycol, Glyercyl Stearate SE, Stearic Acid, Glyceryl Stearate, Helianthus Annuus (Sunflower) Seed Oil, Sodium C12-15 Pareth-15 Sulfonate, Cetyl Alcohol, PEG-2 Cocamide, Cetearyl Alcohol, Triethanolamine, Jojoba Esters, Macadamia Integrifolia Seed Oil, Polyquaternium-39, Sodium Lauryl Sulfate, Phenoxyethanol, Ceteareth-20, Methylparaben, Carbomer, Titanium Dioxide, Parfum (Fragrance), Avena Sativa Kernel Flour (Oat) Kernel Flour, Disodium EDTA, Ethylparaben, Butylparaben, Propylene Glycol, Propylparaben, Isobutylparaben, Rosa Canina Flower Extract, Salvia Officinalis Leaf Extract (Sage) Leaf Extract, Chamomilla Recutita (Matricaria) Flower Extract, Urtica Dioica (Nettle) Extract, Methylisothiazolinone, Methylchloroisothiazolinone, Magnesium Nitrate, Magnesium Chloride, Linalool, Geraniol Alpha-Isomethyl Ionone, Citronellol, Benzyl Benzoate, Benzyl Alcohol, Isoeugenol, Benzyl Salicylate, Limonene, CI 14700 (Red 4), CI 19140 (Yellow 5), CI 15985 (Yellow 6).",0,0,0,0,0
Moisturizer,YOUTH TO THE PEOPLE,Superfood Air-Whip Hyaluronic Acid Moisture Cream,48,4.2,"Water, Helianthus Annuus (Sunflower) Seed Oil, Glyceryl Stearate, Cetyl Alcohol, Lecithin, Glycerin, Tocopheryl Acetate (Vitamin E), Ascorbic Acid (Vitamin C), Panthenol (Vitamin B5), Sodium Hyaluronate Crosspolymer, Butylene Glycol, Brassica Oleracea (Kale) Leaf Extract, Spinacia Oleracea (Spinach) Leaf Extract, Camellia Sinensis (Green Tea) Leaf Extract, Chamomilla Recutita (Matricaria) Flower Extract, Medicago Sativa (Alfalfa) Extract, Aloe Barbadensis (Aloe Vera) Leaf Extract, Sodium Hyaluronate, Natural Fragrance, Hydroxyethylcellulose, Pentylene Glycol, Ethylhexylglycerin, Phenoxyethanol, Potassium Sorbate, Sodium Benzoate, Chlorophyll.",1,0,1,1,1
Cleanser,CLINIQUE,Clarifying Lotion 2,16,4.4,"Water , Alcohol Denat. , Glycerin , Hamamelis Virginiana (Witch Hazel) , Menthol , Acetyl Glucosamine , Trehalose , Sodium Hyaluronate , Butylene Glycol , Sodium Bicarbonate , Red 6 (Ci 15850) , Red 33 (Ci 17200) , Ext. Violet 2 (Ci 60730)",0,0,0,0,0
Eye cream,ESTÉE LAUDER,Advanced Night Repair Eye Serum Synchronized Complex II,66,3.5,"Advanced Night Rp Eye Sr Syn Cmpii Division: El (Estee Lauder)Ingredients: Water , Bifida Ferment Lysate , Caprylic/Capric Triglyceride , Dimethicone , Nylon-12 , Cetyl Ricinoleate , Propanediol , Bis-Peg-18 Methyl Ether Dimethyl Silane , Glycerin , Trehalose , Algae Extract , Morus Bombycis (Mulberry) Root Extract , Scutellaria Baicalensis Root Extract , Lactobacillus Ferment , Triticum Vulgare (Wheat) Germ Extract , Betula Alba (Birch) Extract , Hydrolyzed Algin , Poria Cocos Sclerotium Extract , Glycine Soja (Soybean) Seed Extract , Sucrose , Yeast Extract/Faex/Extrait De Levure , Hydrogenated Lecithin , Hordeum Vulgare (Barley) Extract/Extrait D'Orge , Cholesterol , Anthemis Nobilis (Chamomile) , Tocopheryl Acetate , Sodium Rna , Tromethamine , Caffeine , Caprylyl Glycol , Oleth-10 , Phytosphingosine , Squalane , Ammonium Acryloyldimethyltaurate/Vp Copolymer , Potassium Sulfate , Biosaccharide Gum - 1 , Lecithin , Sodium Hyaluronate , Acrylates/C10-30 Alkyl Acrylate Crosspolymer , Sodium Acrylates/Acrylonitrogens Copolymer , Hexylene Glycol , Sodium Metabisulfite , Aminopropyl Ascorbyl Phosphate , Tripeptide-32 , Butylene Glycol , Sodium Sulfite , Disodium Edta , Bht , Phenoxyethanol , Mica , Titanium Dioxide (Ci 77891) , Iron Oxides (Ci 77491, Ci 77492, Ci 77499)",1,1,1,1,1
Cleanser,LANEIGE,Essential Power Skin Toner for Normal to Dry Skin,28,4.5,"Water, Glycereth-26, Alcohol, Butylene Glycol, PEG/PPG-17, 6 Copolymer, Glycogen, Glutamic Acid, Lysine HCL, Magnesium Sulfate, Mannitol, Manganese Sulfate, Opuntia Coccinellifera Fruit Extract, Betaglucan, Betaine, Serine, Sucrose, Citrulline, Ascorbyl Glucoside, Alanine, Arginine, Betula Platyphylla Japonica Juice, Zinc Sulfate, Calcium Chloride, Chenopodium Quinoa Seed Extract, Threonine, Panthenol, PCA, Histidine HCL, Glycerin, BIS-PEG-18 Methyl Ether Dimethyl Silane, Ethylhexylglycerin, Xanthan Gum, Phenyl Trimethicone, Propanediol, PEG-60 Hydrogenated Castor Oil, Hydroxyethyl Acrylate, Sodium Acryloyldimethyl Taurate Copolymer, Disodium EDTA, Phenoxyethanol, Fragrance.",1,1,1,0,1
Face Mask,LANCER,Younger® Revealing Mask Intense,250,4.3,"Iron Powder, Dimethicone, Polymethylsilsesquioxane, Cetearyl Dimethicone, Polysilicone-11, Dimethicone/Divinyldimethicone/Silsesquioxane Crosspolymer, Hydrogenated Coco-Glycerides, Tribehenin, Caprylic/Capric Triglyceride, Glyceryl Stearate, Hydroxypinacolone Retinoate, Isohexadecane, Cetearyl Alcohol, Stearyl Alcohol, Behenyl Alcohol, Palmitic Acid, Stearic Acid, Ammonium Polyacryloyldimethyl Taurate, Polysorbate 20, Polysorbate 80, Tocopheryl Acetate, Menthoxypropanediol, Vanillyl Butyl Ether, Dimethyl Isosorbide.",1,1,1,1,1
Cleanser,FIRST AID BEAUTY,Skin Rescue Deep Cleanser With Red Clay,24,4.3,"Water, Sodium Lauroyl Sarcosinate, Cocamidopropyl Betaine, Glycerin, Peg-120 Methyl Glucose Dioleate, Acrylates/Steareth-20 Methacrylate Copolymer, Dipropylene Glycol, Camellia Sinensis Leaf Extract, Chrysanthemum Parthenium (Feverfew) Extract, Glycyrrhiza Uralensis (Licorice) Root Extract, Bisabolol, Rosmarinus Officinalis (Rosemary) Leaf Oil, Allantoin, Acrylates/C10-30 Alkyl Acrylate Crosspolymer, Panthenol, Illite, Potassium Hydroxide, Disodium Edta, Mica, Caprylyl Glycol, Phenoxyethanol, Iron Oxides (Ci 77491).",1,1,1,1,1
