Label,Brand,Name,Price,Rank,Ingredients,Combination,Dry,Normal,Oily,Sensitive
Cleanser,KATE SOMERVILLE,Detox Daily Cleanser,36,4.3,"Water, Sodium Laureth Sulfate, Acrylates Copolymer, Cocamidopropyl Betaine, Glycerin, Polysorbate 20, Phytic Acid, Sodium Hydroxide, Salicylic Acid, Sodium Citrate, Butylene Glycol, Citrus Reticulata (Tangerine) Peel Oil, Sodium PCA, Melaleuca Alternifolia (Tea Tree) Leaf Oil, Cyanocobalamin, Urea, Panthenol, Glycolic Acid, Lactic Acid, Allantoin, Aloe Barbadensis Leaf Juice Powder, Sodium Riboflavin Phosphate, Citric Acid, Disodium EDTA, Potassium Sorbate, Sodium Benzoate, Chlorphenesin, Limonene.",1,0,1,1,0
Treatment,DIOR,Capture Youth Lift Sculptor Age-Delay Lifting Serum,95,5.0,Visit the Dior boutique,0,1,1,0,0
Treatment,PHILOSOPHY,Help Me,49,4.4,"Water, Caprylic/Capric Triglyceride, Emulsfying Wax, Glycerin, C10-30 Cholesterol, Lanosterol Esters, Cetyl Ricinoleate, Cetyl Alcohol, Dimethicone, Benzyl Alcohol, Cyclomethicone, Retinol , Tocopherol Acetate, Ascorbyl Palmitate, Methyl Methacrylate/ Glycol Dimethacrylate Crosspolymer, Stearic Acid, Peg-10 Soy Sterol, Phenoxyethanol, Magnesium Aluminum Silicate, Methylparaben, Triethanolamine, Disodium Edta, Bisabolol, Bht, Polysorbate 20, Propyl Gallate, Ascorbic Acid.",0,0,0,0,0
Sun protect,COOLA,Mineral Face SPF 30 - Matte Tint,36,4.1,"Aluminum Hydroxide, Butyrospermum Parkii (Organic Shea Butter), Cucumis Sativus (Organic Cucumber) Fruit Extract, Cyclopentasiloxane, Dimethicone Crosspolymer, Glycerin (Organic), Hydrogen Dimethicone, Iron Oxides, Isopropyl Myristate, Isopropyl Titianium Triisostearate, Linum Usitatissimum (Organic Linseed) Seed Oil, Mica, Oenothera Biennis (Organic Evening Primrose) Oil, Plankton Extract, Polyamide-5, Polysilicone-11, Propylene Carbonate, Rosa Canina (Organic) Fruit Oil, Silica Silylate, Stearalkonium Hectorite, Synthetic Wax.",1,0,1,1,1
Face Mask,ORIGINS,Clear Improvement™ Charcoal Honey Mask to Purify and Nourish,34,4.7,*Essential Oil,1,1,1,1,0
Moisturizer,YOUTH TO THE PEOPLE,Adaptogen Deep Moisture Cream,58,4.8,"Purified Water, Helianthus Annuus (Sunflower) Oil, Octyl Palmitate, Glyceryl Stearate, Propanediol, Stearic Acid, Rhodiola Rosea, Ocimum Tenuiflorum (Holy Basil), Withania Somnifera (Ashwagandha), Ganoderma Lucidum (Reishi Mushroom), Aloe Barbadensis Leaf Juice, Glyceryl Mono Laurate, Squalane (Olive), Phenoxyethanol, Simmondsia Chineses (Jojoba) Seed Oil, Pentapeptide-59, Hydrogenated Lecithin, Butyrospermum Parkii (Shea) Butter, Phenethyl Alcohol, Ethylhexylglycerin, Maltodextrin, Carbomer, Mixed Tocopherols, Ethylhexylglycerin, Allantoin, Panthenol, Prunus Amygdalus Dulcis (Sweet Almond) Oil, Borago Officinalis (Borage) Oil, Caramel Color, Xanthan Gum.",1,1,1,1,1
Sun protect,SHISEIDO,Future Solution LX Total Protective Emulsion Broad Spectrum SPF 20 Sunscreen,260,3.0,"Dipropylene Glycol, Sd Alcohol 40-B, Glycerin, Hydrogenated Polydecene, Xylitol, Isododecane, Dimethicone, Peg-5 Glyceryl Stearate, Isostearic Acid, Silica, Phenyl Trimethicone, Triethanolamine, Xanthan Gum, Tocopheryl Acetate, Peg/Ppg-17/4 Dimethyl Ether, Piperidinepropionic Acid, Phytosteryl Macadamiate, 2-O-Ethyl Ascorbic Acid, Prunus Speciosa Leaf Extract, Angelica Acutiloba Root Extract, Isodonis Japonicus Leaf/Stalk Extract, Camellia Sinensis Leaf Extract, Zanthoxylum Piperitum Peel Extract, Ppg-17, Glyceryl Stearate Se, Behenyl Alcohol, Behenic Acid, Stearic Acid, Batyl Alcohol, Peg-30 Phytosterol, Butylene Glycol, Carbomer, Disodium Edta, Alcohol, Bht, Cellulose Gum, Sodium Metaphosphate, Talc, Dextrin Palmitate, Tocopherol, Ethylparaben, Methylparaben, Fragrance, Iron Oxides.",1,1,1,1,1
Moisturizer,CLINIQUE,Moisture Surge CC Cream Hydrating Colour Corrector Broad Spectrum SPF 30,39,3.8,"Water, Squalane, Octyldodecyl Neopentanoate, Butylene Glycol, Propanediol, Glyceryl Stearate, Behenyl Alcohol, Peg-40 Stearate, Polyglyceryl-10 Pentastearate, Aloe Barbadensis Leaf Water, Thermus Thermophillus Ferment, Trehalose, Caffeine, Glycerin, Linoleic Acid, Lecithin, Stearic Acid, Hydrogenated Lecithin, Sorbitol, Polyglyceryl-6 Polyricinoleate, Tocopheryl Acetate, Ammonium Acryloyldimethyltaurate/Vp Copolymer, Sodium Stearoyl Lactylate, Sodium Hyaluronate, Tetrahexyldecyl Ascorbate, Pentaerythrityl Tetra-Di-T-Butyl Hydroxyhydrocinnamate, Isopropyl Titanium Triisostearate, Synthetic Fluorphlogopite, Xanthan Gum, Silica, Alumina, Sodium Dehydroacetate, Tin Oxide, Disodium Edta, Phenoxyethanol, [+/- Mica, Titanium Dioxide (Ci 77891), Iron Oxides (Ci 77492), Iron Oxides (Ci 77491), Iron Oxides (Ci 77499)].",0,0,0,0,0
Eye cream,KIEHL'S SINCE 1851,Creamy Eye Treatment with Avocado,29,4.3,"Water, Butyrospermum Parkii Butter, Shea Butter, Butylene Glycol, Tridecyl Stearate, Isodecyl Salicylate, Peg-30 Dipolyhydroxystearate, Tridecyl Trimellitate, Persea Gratissima Oil, Avocado Oil, Isocetyl Stearoyl Stearate, Propylene Glycol, Dipentaerythrityl Hexacaprylate/Hexacaprate, Sorbitan Sesquioleate, Magnesium Sulfate, Phenoxyethanol, Hydrogenated Castor Oil, Sodium Pca, Ozokerite, Methylparaben, Tocopheryl Acetate, Isopropyl Palmitate, Disodium Edta, Copper Pca, Butylparaben, Ethylparaben, Propylparaben, Zea Mays Oil, Corn Oil, Beta-Carotene.",1,1,1,1,1
Face Mask,SEPHORA COLLECTION,Face Mask,6,4.3,"Water, Butylene Glycol, Glycerin, Betaine, Aloe Barbadensis Leaf Juice, 1,2-Hexanediol, Hydroxyacetophenone, Xanthan Gum, Sargassum Muticum Extract, Moringa Pterygosperma Seed Extract, Parfum (Fragrance), Phenoxyethanol, Leuconostoc/Radish Root Ferment Filtrate, Vitis Vinifera (Grape) Fruit Extract, Citric Acid, Potassium Sorbate, Sodium Benzoate, Vitis Vinifera (Grape) Leaf Extract.",1,1,1,1,1
Eye cream,BAREMINERALS,BRILLIANT FUTURE™ Age Defense & Renew Eye Cream,38,3.5,Visit the bareMinerals boutique,1,1,1,1,0
Cleanser,CLINIQUE,Acne Solutions Cleansing Foam,21,4.2,"Water , Glycerin , Butylene Glycol , Sodium Methyl Cocoyl Taurate , Sucrose , Disodium Phosphate , Arginine Cocoate , Laminaria Saccharina Extract , Caffeine , Algae Extract , Cola Acuminata (Kola) Seed Extract , Sea Whip Extract , Peg/Ppg-18/18 Dimethicone , Sodium Hyaluronate , Ppg-6-Decyltetradeceth-30 , Lactobacillus Ferment , Stearamidopropyl Dimethylamine , Acetyl Glucosamine , Capryloyl Glycine , 10-Hydroxydecanoic Acid , Polyquaternium-7 , Phospholipids , Stearic Acid , Sodium Hydroxide , Disodium Edta , Phenoxyethanol , Chloroxylenol",1,1,1,1,0
Moisturizer,TATA HARPER,Repairative Moisturizer,110,3.4,*Ingredients from organic farming. **Clinical grade essential oils blend.,0,1,0,0,0
Face Mask,CAUDALIE,Moisturizing Mask,39,4.3,"Water, Glycerin*, Isononyl Isononanoate, Vitis Vinifera (Grape) Seed Oil*, Sorbitan Stearate*, Peg-100 Stearate*, Glyceryl Stearate*, Ceteth-20*, Hydroxyethyl Acrylate/Sodium Acryloyldimethyl Taurate Copolymer, Squalane*, Cetyl Alcohol*, Cetyl Palmitate*, Dimethicone, Butylene Glycol*, Ci 77891 (Titanium Dioxide), Sodium Dehydroacetate, Caprylyl Glycol, Polysorbate 60*, Parfum (Fragrance), Tocopherol*, Carbomer, Sodium Phytate*, Sodium Hydroxide, Scutellaria Baicalensis Root Extract*, Acrylates/C10-30 Alkyl Acrylate Crosspolymer, Sodium Carboxymethyl Beta-Glucan, Sodium Hyaluronate, Hexyl Cinnamal, Linalool, Limonene, Benzyl Benzoate, Citronellol. *Plant origin.",1,1,1,0,1
Treatment,DR. DENNIS GROSS SKINCARE,Alpha Beta® Universal Daily Peel,88,4.5,"-Glycolic Acid: Reduces the signs of aging. -Salicylic Acid: Reduces pore blockages and supports natural collagen. -Malic Acid: Supports natural cell renewal, fights the appearance of wrinkles, exfoliates, and moisturizes. -Genistein: Supports optimum natural collagen levels. -Lactic Acid (AHA) and Citric Acid (AHA) Step One: Water, Alcohol Denat. (SD Alcohol 40-B), Glycolic Acid, Potassium Hydroxide, Hamamelis Virginiana (Witch Hazel) Water, Salicylic Acid, Polysorbate 20, Citric Acid, Lactic Acid, Malic Acid, Camellia Sinensis Leaf Extract, Achillea Millefolium Extract, Anthemis Nobilis (Chamomile) Flower Extract, Soy Isoflavones, Copper PCA, Zinc PCA, Lecithin, Disodium EDTA, Alcohol, Polysorbate 80, Fragrance, Linalool, Benzyl Salicylate, Benzoic Acid, Phenoxyethanol, Sodium Benzoate. Step 2: Water, Sodium Bicarbonate, Ascorbic Acid, Ascorbyl Palmitate, Retinyl Palmitate, Retinol, Tocopheryl Acetate, Resveratrol, Ubiquinone, Achillea Millefolium Extract , Camellia Sinensis Leaf Extract, Raphanus Sativus (Radish) Root Extract, Soy Isoflavones, Phospholipids, Copper PCA, Sodium PCA, Zinc PCA, Lecithin, Polysorbate 20, Polysorbate 80, Octoxynol-9, Simethicone, Alcohol, BHT, Tetrasodium EDTA, Sodium Benzoate, Phenoxyethanol.",1,1,1,1,0
Cleanser,CLINIQUE,Foaming Sonic Facial Soap,21,4.1,Visit the CLINIQUE boutique,0,0,0,0,0
Face Mask,REN CLEAN SKINCARE,Evercalm™ Ultra Comforting Rescue Mask,38,4.5,*100% Natural Fragrance,0,0,0,0,1
Cleanser,CLINIQUE,7 Day Scrub Cream Rinse-Off Formula,22,4.6,"Water , Tridecyl Stearate , Tridecyl Trimellitate , Dipentaerythrityl Hexacaprylate/Hexacaprate , Butylene Glycol , Glyceryl Stearate , Cocos Nucifera (Coconut) Oil , Caprylic/Capric Triglyceride , Silica , Cetearyl Alcohol , Ceteareth-20 , Sorbitol , Hexyldecyl Stearate , Bisabolol , Disodium Cocoamphodipropionate , Triethanolamine , Oleth-10 Phosphate , Caprylyl Glycol , 1,2-Hexanediol , Stearyl Alcohol , Carbomer , Disodium Edta , Phenoxyethanol , Potassium Sorbate , Chlorphenesin",0,0,0,0,0
Cleanser,SEPHORA COLLECTION,Cleansing & Exfoliating Wipes,7,4.5,"Water, Caprylic/Capric Triglyceride, Fragrance, Phenoxyethanol, Glycerin, Benzyl Alcohol, Ethylhexylglycerin, Glyceryl Stearate, Sodium Lauroyl Lactylate, Lauryl Glucoside, Cocos Nucifera (Coconut) Fruit Juice, Cetearyl Alcohol, Sodium Stearoyl Lactylate, Sodium Hydroxide, Limonene, Tocopherol, Citric Acid, Sodium Benzoate, Potassium Sorbate.",0,0,0,0,0
Moisturizer,MAKE UP FOR EVER,Mist & Fix Setting Spray,30,4.2,Visit the MAKE UP FOR EVER boutique,0,0,0,0,0
Face Mask,J.ONE,Black Jelly Pack,44,4.8,"-Red Wine Extract: Increases skin’s natural cell turnover and fights free radicals. -Black Bee Propolis: Soothes and calms. -Black Truffle Extract: Creates visibly plumper, firmer skin. -Black Cumin Seed: Delivers antioxidant-rich vitamin E to boost skin’s natural repair of photo aging.",1,1,1,1,1
Treatment,SUNDAY RILEY,Saturn Sulfur Acne Treatment Mask,55,4.3,"Water, Sulfur, Isoamyl Laurate, Cetyl Ethylhexanoate, Niacinamide, Gum Arabic, Bentonite, Hydroxyethyl Acrylate/Sodium Acryloyldimethyl Taurate Copolymer, Polyglyceryl-2 Caprate, Olive Oil Glyceryth-8 Esters, Zinc PCA, Allantoin, Dipotassium Glycyrrhizate,, Melaleuca Alternifolia (Tea Tree) Leaf Oil, Leptospermum Scoparium (Manuka) Branch/Leaf Oil, Curcuma Longa (Turmeric) Root Extract, Corallina Officinalis Extract, Melia Azadirachta Leaf Extract, Amber Powder, Melia Azadirachta Flower Extract, Coccinia Indica Fruit Extract, Solanum Melongena (Eggplant) Leaf Extract, Ocimum Basilicum (Basil) Flower/Leaf Extract, Quartz, Polysorbate 60, Sorbitan Isostearate, Tocopherol, Disodium EDTA, Phenoxyethanol, Polysorbate 20, Alcohol Denat., Chlorphenesin, PEG-40 Hydrogenated Castor Oil, Caprylyl Glycol.",1,1,1,1,1
Face Mask,SEPHORA COLLECTION,Face Mask - Avocado,6,4.6,"Water, Butylene Glycol, Glycerin, Peg-40 Hydrogenated Castor Oil, Phenoxyethanol, Aloe Barbadensis Leaf Juice, Triethanolamine, Oryza Sativa (Rice) Extract, Acrylates/C10-30 Alkyl Acrylate Crosspolymer, Tremella Fuciformis (Mushroom) Extract, Piroctone Olamine, Fragrance, Maltodextrin, Polyquaternium-51, Persea Gratissima (Avocado) Oil, Brassica Oleracea Italica (Broccoli) Sprout Extract, Linalool, Peg-30 Dipolyhydroxystearate, Trideceth-6, Limonene, Citric Acid, Potassium Sorbate, Sodium Benzoate.",0,0,0,0,0
Moisturizer,OLEHENRIKSEN,Truth Revealed™ Brightening Broad Spectrum SPF 15 Moisturizer,55,4.2,"Water, Cocoglycerides, Ethylhexyl Salicylate, Ethylhexyl Methoxycinnamate, Glycerin, Cetearyl Alcohol, Butyl Methoxydibenzoylmethane, Glyceryl Stearate, Ceteareth-20, PEG-100 Stearate, Dimethicone, Phenoxyethanol, Parfum/Fragrance, Tetrahexyldecyl Ascorbate, Polyacrylate-13, Aminomethyl Propanol, Pullulan, Plukenetia Volubilis Seed Oil, Carbomer, Vaccinium Myrtillus (Bilberry) Fruit Extract, Tocopheryl Acetate, Polyisobutene, Allantoin, Saccharum Officinarum (Sugar Cane) Extract, Ethylhexylglycerin, Potassium Sorbate, Bisabolol, Nannochloropsis Oculata Extract, Tetrasodium Glutamate Diacetate, Citrus Aurantium Dulcis (Orange) Fruit Extract, Citrus Limon (Lemon) Fruit Extract, Polysorbate 20, Aroma/Flavor, Sorbitan Isostearate, Acer Saccharum (Sugar Maple) Extract, Aloe Barbadensis Leaf Juice, Avena Sativa (Oat) Kernel Extract, Chamomilla Recutita (Matricaria) Flower Extract, Corylus Americana (Hazel) Seed Extract, Daucus Carota Sativa (Carrot) Root Extract, Palmitoyl Tripeptide-5, Chondrus Crispus (Carrageenan) Extract, Sodium Benzoate, BHT, Schinus Terebinthifolius Seed Extract, Sodium Hydroxide, Citric Acid, Calcium Ascorbate, Sodium Hyaluronate, Tocopherol, Benzyl Benzoate, Citral, Limonene, Linalool, Benzyl Alcohol.",1,1,1,1,1
Eye cream,TATCHA,Luminous Deep Hydration Firming Eye Serum,85,4.0,"Water, Glycerin, Propanediol, Peg-400, Squalane (Olive Origin), Sericin (Silk Extract), Camellia Sinensis (Green Tea) Leaf Extract, Origanum Majorana Leaf Extract, Panax Ginseng Root Extract, Lonicera Japonica (Honeysuckle) Leaf Extract, Stearyl Glycyrrhetinate (Licorice), Caffeine, Royal Jelly Extract, Thymus Serpillum Extract, Gold, Algae Extract, Hydrolyzed Hyaluronic Acid, Persea Gratissima (Avocado) Oil, Prunus Armeniaca (Apricot) Kernel Oil, Rosa Canina Fruit Oil, Inositol (Rice Extract), Helianthus Annuus (Sunflower) Seed Oil, Hydrogenated Lecithin, Sodium Hyaluronate Crosspolymer, Glycosyl Trehalose, Hydrogenated Starch Hydrolysate, Potassium Hydroxide, Sodium Dilauramidoglutamide Lysine, Natto Gum, Xanthan Gum, Disodium Edta, Sorbitan Stearate, Dimethicone, Dipentaerythrityl Hexahydroxystearate, Carbomer, Mica, Tin Oxide, Titanium Dioxide, Butylene Glycol, Pentylene Glycol, Sodium Chloride, Ethylhexylglycerin, Behenyl Alcohol, Alcohol, Phenoxyethanol.",0,0,0,0,0
Cleanser,SEPHORA COLLECTION,Black Magic Set of 2 Makeup Remover Cloths,12,4.6,No Info,0,0,0,0,0
Eye cream,AMOREPACIFIC,MOISTURE BOUND Rejuvenating Eye Treatment Gel,85,4.3,"Phyllostachis Bambusoides Juice, Cyclopentasiloxane, Dimethicone, Glycerin, Butylene Glycol, Cyclohexasiloxane, Alcohol, Water, PEG-75, PEG-10 Dimethicone, Biosaccharide Gum-1, Squalane, Niacinamide, Acetyl Glucosamine, Hydrolyzed Phyllostachis Bambusoides, Hydrolyzed Camellia Sinensis Leaf, Glycine Soja (Soybean) Seed Extract, Nelumbo Nucifera Flower Extract, Opuntia Coccinellifera Fruit Extract, Hesperidin, Caffeine, Theanine, Kaempferol, Camellia Sinensis Flower Extract, Natto Gum, Beta-Glucan, Sodium Hyaluronate, Tocopherol, Phytantriol, Epigallocatechin Gallate, Disteardimonium Hectorite, Lauryl PEG-9 Polydimethylsiloxyethyl Dimethicone, Polysilicone-11, Propanediol, Dimethiconol, Dimethicone/Vinyl Dimethicone Crosspolymer, Stearyl Behenate, Polyglyceryl-3 Methylglucose Distearate, Hydroxypropyl Bispalmitamide Mea, Inulin Lauryl Carbamate, Polysorbate 20, PEG-15 Pentaerythrityl Tetra (Laureth-6 Carboxylate), Sodium Chloride, Poloxamer 407, Ammonium Acryloyldimethyltaurate/VP Copolymer, 1,2-Hexanediol, Disodium EDTA, Ethylhexylglycerin, Phenoxyethanol, Fragrance.",1,1,1,1,1
Eye cream,YVES SAINT LAURENT,Forever Light Creator Eye Fluid,73,3.4,No Info,0,0,0,0,0
Treatment,FRESH,Seaberry Skin Nutrition Booster,46,4.5,"Camellia Oleifera Seed Oil, Prunus Armeniaca (Apricot) Kernel Oil, Hippophae Rhamnoides Oil, Solanum Lycopersicum (Tomato) Fruit/Leaf/Stem Extract, Bixa Orellana Seed Extract, Helianthus Annuus (Sunflower) Seed Oil, Rosmarinus Officinalis (Rosemary) Leaf Extract, Ascorbyl Tetraisopalmitate, Tocopherol, Caprylic/Capric Triglyceride, Bht.",0,0,0,0,0
Face Mask,BOSCIA,Multi-Masking™ Medley,18,4.1,"Luminizing Black Mask: Water, Polyvinyl Alcohol, Hamamelis Virginiana (Witch Hazel) Water, Glycereth-26, Butylene Glycol, Glycerin, Pentylene Glycol, Montmorillonite, Polysorbate 20, Acrylates/Palmeth-25 Acrylate Copolymer, Acrylates Copolymer, Lonicera Japonica (Honeysuckle) Flower Extract, Xanthan Gum, Ascorbyl Glucoside, Lonicera Caprifolium (Honeysuckle) Flower Extract, Diglycerin, Simmondsia Chinensis (Jojoba) Seed Extract, Epilobium Angustifolium Flower/Leaf/Stem Extract, Pinus Pinaster Bark Extract, Rosmarinus Officinalis (Rosemary) Leaf Oil, Eucalyptus Globulus Leaf Oil, Charcoal Powder, Iron Oxides (CI 77499). Green Tea Oil-Control Mask: Water, Polyvinyl Alcohol, Polysorbate 20, PPG-20 Methyl Glucose Ether, Butylene Glycol, Lactobacillus Ferment, Glycerin, Glycereth-26, Acrylates/C10-30 Alkyl Acrylate Crosspolymer, Montmorillonite, Silica, Menthyl Lactate, Caprylyl Glycol, 1,2-Hexanediol, Camellia Oleifera Leaf Extract, Potassium Hydroxide, Cucumis Sativus (Cucumber) Fruit Extract, Melia Azadirachta Leaf Extract, Curcuma Longa (Turmeric) Root Extract, Melia Azadirachta Flower Extract, Corallina Officinalis Extract, Simmondsia Chinensis (Jojoba) Seed Extract, Ocimum Basilicum (Basil) Flower/Leaf Extract, Arctium Majus Root Extract, Ocimum Sanctum Leaf Extract, Epilobium Angustifolium Flower/Leaf/Stem Extract, Jasminum Officinale (Jasmine) Oil, Triethoxycaprylylsilane, Aloe Barbadensis Leaf Juice, Citrus Aurantium Dulcis (Orange) Peel Oil, Maltodextrin, Leuconostoc/Radish Root Ferment Filtrate, Carbomer, Palmitoyl Tripeptide-1, Palmitoyl Tetrapeptide-7, Titanium Dioxide (CI 77891), Mica (CI 77019), Chromium Hydroxide Green (CI 77289). Sake Bright White Mask: Water, PPG-20 Methyl Glucose Ether, Polyvinyl Alcohol, Glycerin, Polysorbate 20, Polysorbate 60, Sorbitol, Montmorillonite, Pentylene Glycol, Caprylyl Glycol, 1,2-Hexanediol, Hydroxyacetophenone, Panthenol, Acrylates/C10-30 Alkyl Acrylate Copolymer, Silica, Acrylates Copolymer, Potassium Hydroxide, Butylene Glycol, Dictyopteris Membranacea Extract, Simmondsia Chinensis (Jojoba) Seed Extract, Camellia Sinensis Leaf Extract, Sodium Ascorbyl Phosphate, Caprylic/Capric Triglyceride, Epilobium Angustifolium Flower/Leaf/Stem Extract, Citrus Aurantium Amara (Bitter Orange) Flower Oil, Eugenia Caryophyllus (Clove) Leaf, Citric Acid, Rice Ferment Filtrate (Sake), Carbomer, Salicornia Herbacea Extract, Palmitoyl Tripeptide-1, Palmitoyl Tetrapeptide-7, Titanium Dioxide (CI 77891), Mica (CI 77019).",1,1,1,1,1
Treatment,SHISEIDO,Ultimune Power Infusing Concentrate,100,4.2,"-ImuGeneration Technology: Features botanical extracts of reishi mushroom and iris root to continuously fortify skin’s ability to defend itself. -Exclusive Ultimune Complex™ (Bulgarian Rose Water, Aqua in Pool, and Yeast Extract: Protects and strengthens skin against day to day damage and signs of aging, while a powerful botanical blend of gingko biloba leaf extract, shiso, and thyme maintain a healthy-looking skin surface. - ImuCalm Compound™: Contains fragrance ingredients of rose and lotus elements and a green floral fragrance. -Reishi Mushrooms: Rich antioxidants containing polysaccharides (sugars) that are known to hydrate and visibly reduce aging. -Iris Root: Recognized for its vitality and ability to keep skin moisturized.",1,1,1,1,1
Sun protect,CLINIQUE,Superdefense SPF 20 Age Defense Moisturizer Combination Oily to Oily,48,4.0,"Avobenzone 3.00% , Octisalate 5.00%Water , Butyloctyl Salicylate , Glycerin , Polyester-8 , Polysorbate 60 , Dimethicone , Butylene Glycol , Cetyl Alcohol , Sorbitan Stearate , Tridecyl Stearate , Peg-100 Stearate , Trehalose , Sigesbeckia Orientalis (St. Paul'S Wort) Extract , Hordeum Vulgare (Barley) Extract/Extrait D'Orge , Triticum Vulgare (Wheat) Germ Extract , Arabidopsis Thaliana Extract , Laminaria Saccharina Extract , Plankton Extract , Algae Extract , Sea Whip Extract , Lactobacillus Ferment , Micrococcus Lysate , Ergothioneine , Caffeine , Lecithin , Sodium Hyaluronate , Pentylene Glycol , Tridecyl Trimellitate , Dipentaerythrityl Hexacaprylate/Hexacaprate , Tocopheryl Acetate , Ethylhexylglycerin , Squalane , Cetyl Palmitate , Acrylates/C10-30 Alkyl Acrylate Crosspolymer , Sorbitan Palmitate , Sorbitan Olivate , Polyethylene , Sodium Benzoate , Ethylene/Va Copolymer , Tetrahexyldecyl Ascorbate , Dimethiconol , Sodium Polyacrylate , Sodium Hydroxide , Pentaerythrityl Tetra-Di-T-Butyl Hydroxyhydrocinnamate , Disodium Edta , Phenoxyethanol , Chlorphenesin",0,0,0,0,0
Moisturizer,DR. DENNIS GROSS SKINCARE,C+ Collagen Deep Cream,72,4.2,"Water, Glycerin, Butylene Glycol, Camellia Japonica Seed Oil, Oryza Sativa (Rice) Bran Oil, Dimethicone, Sucrose, Pentylene Glycol, Helianthus Annuus (Sunflower) Seed Oil, Hydroxyethyl Acrylate/Sodium Acryloyldimethyl Taurate Copolymer, 3-O-Ethyl Ascorbic Acid, Collagen Amino Acids, Niacinamide, Carnitine HCl, Hydroxyproline, Glycine, Carnitine, Squalane, Dipotassium Glycyrrhizate, Tocopherol, Saccharide Isomerate, Acetyl Hexapeptide-8, Superoxide Dismutase, Leuconostoc/Radish Root Ferment Filtrate, Ubiquinone, Aloe Barbadensis Leaf Juice, Camellia Sinensis Leaf Extract, Cucumis Sativus (Cucumber) Fruit Extract, Lactobacillus Ferment, Undaria Pinnatifida Extract, Glycolic Acid, Lecithin, Biotin, Maltodextrin, Elettaria Cardamomum Seed Extract, Pyrus Malus (Apple) Fruit Extract, Rubus Idaeus (Raspberry) Fruit Extract, Cananga Odorata Flower Extract, Citrus Aurantium Amara (Bitter Orange) Flower Extract, Citrus Aurantium Bergamia (Bergamot) Fruit Extract, Coffea Arabica (Coffee) Seed Extract, Cucumis Melo (Melon) Fruit Extract, Cupressus Sempervirens Leaf/Stem Extract, Fucus Vesiculosus Extract, Jasminum Officinale (Jasmine) Flower Extract, Rose Extract, Rosmarinus Officinalis (Rosemary) Leaf Extract, Salvia Officinalis (Sage) Leaf Extract, Santalum Album (Sandalwood) Wood Extract, Triethyl Citrate, Lavandula Angustifolia (Lavender) Flower/Leaf/Stem Extract, 1,2-Hexanediol, Sorbitan Isostearate, Caprylyl Glycol, Hydroxyethylcellulose, Sodium Phytate, Sodium Citrate, Citric Acid, Trisodium EDTA, Ammonium Hydroxide, Tromethamine, Potassium Hydroxide, Polysorbate 60, Carbomer, Alcohol, Disodium Phosphate, Sodium Phosphate, Phenoxyethanol, Potassium Sorbate.",0,1,1,0,1
Cleanser,TARTE,Knockout Tingling Treatment,39,4.5,"Water, niacinamide, lactic acid, citric acid, propanediol, glycerin, gluconolactone, malic acid, phytic acid, salicylic acid, sodium benzoate, magnesium chloride, acetic acid, potassium sorbate, allium cepa (onion) bulb extract, calcium gluconate, cochlearia armoracia (horseradish) root extract, commiphora myrrha resin extract, myrtus communis extract, rumex acetosa leaf extract, thymus vulgaris (thyme) flower/leaf extract, calcium chloride, sodium chloride, potassium chloride, sulfur.",0,0,0,0,0
Face Mask,DIOR,Hydra Life Pores Away Pink Clay Mask,69,4.2,-Natural Pink Clay: Mattifies. -Jojoba Extract: Hydrates.,1,0,1,1,0
Moisturizer,KIEHL'S SINCE 1851,Ultra Facial Deep Moisture Balm,29,4.7,"Water, Glycerin, Shea Butter, Glyceryl Stearate, Ethylhexyl Palmitate, Squalane, Cetyl Alcohol, Cocoa Seed Butter, Mannose, Peg-100 Stearate, Carnauba Wax, Phenoxyethanol, Caprylyl Glycol, Sorbic Acid, Tocopherol, Sodium Polyacrylate, Leontopodium Alpinum Extract, Sodium Hydroxide, Stearyl Alcohol, Ceramide 3, Myristyl Alcohol, Adenosine, Capryloyl Salicylic Acid, Pseudoalteromonas Ferment Extract, Lavender Oil, Linalool.",0,1,1,0,0
Eye cream,ESTÉE LAUDER,Advanced Night Repair Eye Supercharged Complex,62,4.4,"Advanced Night Repr Eye Sync Cmpii Division: El (Estee Lauder)Ingredients: Methyl Trimethicone, Water, Bifida Ferment Lysate, Dimethicone, Dimethicone/Vinyl Dimethicone Crosspolymer, Propanediol, Sucrose, Petrolatum, Polysorbate 40, Trehalose, Algae Extract, Morus Bombycis (Mulberry) Root Extract, Scutellaria Baicalensis Root Extract, Lactobacillus Ferment, Triticum Vulgare (Wheat) Germ Extract, Acrylamide/Sodium Acryloyldimethyltaurate Copolymer, Betula Alba (Birch) Extract, Hydrolyzed Algin, Poria Cocos Sclerotium Extract, Jojoba Alcohol, Ethylhexylglycerin, Glycine Soja (Soybean) Seed Extract, Isopropyl Jojobate, Jojoba Esters, Isohexadecane, Yeast Extract/Faex/Extrait De Levure, Hydrogenated Lecithin, Hordeum Vulgare (Barley) Extract/Extrait D'Orge, Peg/Ppg-18/18 Dimethicone, Cholesterol, Anthemis Nobilis (Chamomile), Tocopheryl Acetate, Sodium Rna, Caffeine, Polysorbate 80, Caprylyl Glycol, Phytosphingosine, Squalane, Potassium Sulfate, Sodium Hyaluronate, Acrylates/C10-30 Alkyl Acrylate Crosspolymer, Tripeptide-32, Butylene Glycol, Tromethamine, Disodium Edta, Bht, Phenoxyethanol, Iron Oxides (Ci 77491, Ci 77492, Ci 77499) Please be aware that ingredient lists may change or vary from time to time.� Please refer to the ingredient list on the product package you receive for the most up to date list of ingredients.",1,1,1,1,0
Sun protect,FIRST AID BEAUTY,Ultra Repair® Pure Mineral Sunscreen Moisturizer Broad Spectrum SPF 40,30,3.6,"Water, Butyloctyl Salicylate, Cetearyl Alcohol, Caprylic/Capric Triglyceride, Steareth-2, Dimethicone, Squalane, Glycerin, Butylene Glycol, Alumina, Ceteareth-20, Colloidal Oatmeal, Urea, Allantoin, Butyrospermum Parkii (Shea) Butter, Copaifera Officinalis (Balsam Copaiba) Resin, Limnanthes Alba (Meadowfoam) Seed Oil, Persea Gratissima (Avocado) Oil, Chrysanthemum Parthenium (Feverfew) Extract, Camellia Sinensis Leaf Extract, Glycyrrhiza Glabra (Licorice) Root Extract, Ceramide NP, Tocopheryl Acetate, Triethoxycaprylylsilane, Caprylyl Glycol, Isopropyl Titanium Triisostearate, C13-14 Isoparaffin, C12-15 Alkyl Benzoate, Polyhydroxystearic Acid, Laureth-7, Methicone, Leuconostoc/Radish Root Ferment Filtrate, Xanthan Gum, Polyacrylamide, Phenoxyethanol, Disodium EDTA, EDTA.",1,1,1,1,1
